Topic	Count	Name	Representation	Representative_Docs
-1	4486	-1_like_im_people_think	['like', 'im', 'people', 'think', 'right', 'time', 'thats', 'want', 'say', 'trump']	"['little hypocritical knowing Elon officially banned posting social media accounts Twitter, attempting silo Twitter\'s users instead letting free market open sharing information decide social media platform flourishes whatever wants company, I\'m going point personal ethics ideals seem crumble away second start inconveniencing He\'s supposed right\'s libertarian free market champion, soon market forces start disagreeing seems he\'s happy add thumb scale attempt ""correct""', 'Well least admit understand probably fair say none us truly do. However entire purpose nukes point nobody wants hit one. nobody willing risk nuclear annihilation almost anything another country does. wars pointed banks trying maintain hegemony money distributed (loans interest every dollar means impossible pay back without loans, endless debt). sometimes maintain access oil nowadays microprocessors materials make (Ukraine russia aggressor case). also notice simply fighting countries allied anyone control resources. see cost benefit attacking China military shown almost exclusively care economic gains. also see need arms race China all. threaten us bad enough, nuke. threaten bad enough nuke. never going happen unless psychopath gets charge. Even Trump calmed rhetoric becoming president. excuse increase spending. Imagine took 1/4 budget universal Healthcare, abundant homeless shelters, affordable housing, probably double public school budgets still left over. sad really much war little people.', 'appreciate post. Thank that. Tesla is, was, overvalued quite time, lack fundamentals, never bought. scared would collapse true value. P/e way high way long, I\'d bet Must sold ATH. arguing this...but, put (you made introspective position), learned debate school long time ago, taught separate argument. say Elon slightest. merely see position, trying achieve. agree never bought Twitter first place, crucified valuation offered. perplexes never pressed bot issue (??). Seems odd would use excuse pay amount, get tripped hubris offer, ""made buy Twitter."" say much company; execs wanted get company desperately, twisted arm follow offer. Look, saw doge (a MAJOR pump dump scheme). thought going ruin crypto scheme, even though doge complete meme-coin, would used ruin integrity (potentiality) say, Bitcoin itself. fair, Friday SNL show mention ""put life\'s savings"" coin, then, right middle opening monologue, dumped. Lost $20 that, lol. However, revelations made Matt Taibbi, reporters involved disclosures (trading upon ethos), shown are/we\'re irregularities way Twitter went business. may known censored shadow banned, CONFIRMED this. me, big deal, especially Twitter execs claimed otherwise Congressional testimony. made fact, provided evidence this, public forum us discuss. overplay hand ""real time doxxing?"" Heck yes, may downfall. well, playing new toy, fell grace fast, may gone waste. thing make worthwhile another social media company insider whistleblow government involvement unbeknownst public. get wrong, debating ass kisser Musk, rather someone amused games played, taking giant grain salt. empire collapsing anyway, fun see playing out. Honestly, said true, @Jack explaining do, seems kept loop LOT goings company. Perhaps something worth investigating. Either way, pleasure conversing you. enjoyed much. appreciate comments, pushing feed back retorts, thank that.']"
0	325	0_congress_court_constitution_fbi	['congress', 'court', 'constitution', 'fbi', 'doj', 'trump', 'law', 'arms', 'charges', 'justice']	"['actually read dred Scott case. case: case initially guns specifically case directly saying free persons/citizens individual right bear arms, denied Scott privy it. definitely racially motivated clearly shows courts believed individual right. half right Presser Cruikshank. Actually cases upheld second ammendment referred individuals right bear arms *but* applied federal government. course ignores 14th ammendment started getting recognized incorporation th 1800s. Regardless view second ammendment individual right, better yet, incorporation ammendments states via 14th makes individual right across board. founding fathers generally split one two ways, second ammendment absolute providing right bear arms individual right people, see Jefferson Sam Adams, related preservation miltia, see Madison. militia explicitly made common people common people right bear arms individually, people even *expected* arms ready. right bear arms predicted upon individual ownership said arms, contrary said. course gun regulations legal now, universal background check guns violent felons. Still individual right though.', ""Well, I'm defending drafting 14th Amendment, really almost part Constitution. Almost every part could stand written clearly. canons construction still apply, omission something deemed deliberate. drafted Impeachment Clauses specify standard impeachment conviction, would reasonable say simple majority necessary. lower standard would unreasonable, higher standard would be, also, since explicit elsewhere required supermajorities (veto overrides, treaty ratification, etc). conviction impeachment requires ⅔ supermajority, disqualification requires simple majority, since Constitution specifies conviction takes ⅔ supermajority, silent standard disqualification. process Trump due here, vis-a-vis presidency? life, liberty, property interest possesses regarding presidency due process would protecting? bill would make Trump ineligible. idea is, he's *already* ineligible according Constitution. bill would federal government formally expressing opinion he's already barred Constitution. would put him, GOP, GOP primary voters, notice able hold office (or office), could nominate someone else. disagrees, he's free contest court let courts adjudicate whether he, fact, engaged insurrection rebellion. accept government's opinion. But, I've said elsewhere, bill actually makes ineligible, Congress passed bill declaring Obama ineligible would would make ineligible, opposed 22nd Amendment imposing two-term limit made Obama ineligible. bill would Congress formally expressing opinion Obama ineligible. vis-a-vis Trump."", 'There\'s one even 1820s extremely obscure mention. There\'s also numerous quotes guys like Jefferson alluding outright stating right bear arms individual right. ""No free man shall ever debarred use arms."" - Thomas Jefferson, 1776 ""The Constitution states (and United States) assert power inherent people; may exercise themselves; right duty times"" Jefferson ""A militia properly formed fact people themselves…and include, according past general usuage states, men capable bearing arms… “To preserve liberty, essential whole body people always possess arms, taught alike, especially young, use them.” Richard Henry “The Constitution shall never construed prevent people United States peaceable citizens keeping arms.” Samuel Adams. ""The right citizens keep bear arms justly considered, palladium liberties republic; since offers strong moral check usurpation arbitrary power rulers; generally, even successful first instance, enable people resist triumph them.” Joseph Story, Supreme Court Judge, 1833. no, courts never ""just made up, consistently interpreted way since beginning, regardless whether like not.']"
1	212	1_housing_roads_rent_city	['housing', 'roads', 'rent', 'city', 'cities', 'property', 'live', 'landlords', 'town', 'land']	"[""unless LARGE group left isolated large group would funding profit incentives create roads would solve issue. Right would profit incentives build roads long town becomes city. problem think is. literally solution. there's already lots roads far much competition. Besides land roads would prohibitively expensive reducing incentive. There's also lots profit connecting cities small roads built city connecting highway connect towns city. That's called capillary style road building. process living things get blood supply every cell minimal energy expense."", 'sure know read? say bad thing? said there\'s thing ""affordable housing"". market. Affordability relative. afford live New York. affordable average person average person New York. complicated. also said development make prices come because, well, doesn\'t. Development adds value, dilute it. hell people think populous cities also expensive? know cheap live? hour outside Kansas City. Move want affordable housing. always talking building housing units already dense cities instead encouraging development places lack density?', 'entire concept ""affordable housing"" shit premise point. However social housing probably better now. Personally think better ways make housing healthier system, like allowing profit investors buy single family dwellings rent. However, think would make prices come desirable places, would make easier actually place. people now. People cities school live parents. commuters. possible ever problem. course do. part getting demand way way way higher supply supply much harder grow demand. *never* build enough New York City outstrip demand. global appeal. Millions people want live make money you. Either make more, pay higher percentage income, shut move. problem housing affordability easily fixable. Exactly, complain people want make nice city ""affordable"" one. that\'s residents want like. want poor people apparently still getting sweetgreen salads fine. want live somewhere affordable, move there. need know live know basic concept.']"
2	182	2_capitalism_socialism_communism_marx	['capitalism', 'socialism', 'communism', 'marx', 'capitalist', 'socialist', 'workers', 'proletariat', 'economy', 'communist']	"['Look, get post vague attempt (I don’t think deliberately) divert attention problems capitalism say “hey, don’t forgot, socialism communism even awful,” problem experienced really true socialism communism systems; experienced was, else, fascism. It’s Brazil, China anywhere else people try say “socialism doesn’t work.” That’s big issue anytime ideologies get brought up, aren’t argued good faith. want criticize socialism communism model capitalism, fine, guest, please use proper examples capitalism whatever model criticizing. I’m speaking generally here, specifically. However, agree core comment though, regarding importance power, regardless system. It’s why, imperfect was, still admire Greeks system.', 'Good point. capitalism then?', 'TL;DR stay western shit-lib actually read content conversations ask sources you’d find often running theme calling people make outlandish claims communist political economic topics. Ironic considering commentary. deny read Civil War France (1870) yet besides there’s nothing else said truth fuck profiling. said Marx different view Dictatorship proletariat MLs claim be. also gave poor characterization MLs believe DOTP be. detest people type shit give fucking Wikipedia article reference. politically charged topic knowledge database supposedly EVERYONE contribute development many holes communist could take grain salt. Quotes cherry picked easily it’s irony situation considering original call taking Marx context. Lenin already said plenty counter arguments posed Kautsky 2nd International regarding Marx’s commentary DOTP (which you’re getting whether you’re aware not): ”Let us point out, passing, calling non-Bolsheviks Russia, i.e., Mensheviks Socialist-Revolutionaries, socialists, Kautsky guided name, is, word, actual place occupy struggle proletariat bourgeoisie. wonderful understanding application Marxism!” “The question dictatorship proletariat question relation proletarian state bourgeois state, proletarian democracy bourgeois democracy. One would think plain pikestaff. Kautsky, like schoolmaster become dry dust quoting old textbooks history, persistently turns back twentieth century face eighteenth century, hundredth time, number paragraphs, incredibly tedious fashion chews old cud relation bourgeois democracy absolutism medievalism!” “But means utterly fails understand what! One cannot help smiling Kautsky’s effort make appear people preach “contempt democracy” (p. 11) forth. sort twaddle Kautsky uses befog confuse issue, talks like liberals, speaking democracy general, *bourgeois democracy*[my italics]; even avoids using precise, class term, and, instead, tries speak “presocialist” democracy. windbag devotes almost one-third pamphlet, twenty pages sixty-three, twaddle, agreeable bourgeoisie, tantamount embellishing bourgeois democracy, obscures question proletarian revolution.” view” (which Kautsky dubs “contempt democracy”) “rests upon single word Karl Marx’s”. Kautsky literally says page 20. page 60 thing repeated even form (the Bolsheviks) “opportunely recalled little word” (that literally says—des Wörtchens!!) “about dictatorship proletariat Marx used 1875 letter”. Marx’s “little word"": First all, call classical reasoning Marx’s, sums whole revolutionary teaching, “a single word” even “a little word,” insult complete renunciation Marxism. must forgotten Kautsky knows Marx almost heart, and, judging written, desk, head, number pigeon-holes ever written Marx carefully filed ready hand quotation. Kautsky must know Marx Engels, letters well published works, repeatedly spoke dictatorship proletariat, especially Paris Commune. Kautsky must know formula “dictatorship proletariat” merely historically concrete scientifically exact formulation proletariat’s task “smashing” bourgeois state machine, Marx Engels, summing experience Revolution 1848, and, still so, 1871, spoke forty years, 1852 1891.” [All plenty found 1st chapter Lenin’s *The Proletarian Revolution Renegade Kautsky*](https://www.marxists.org/archive/lenin/works/1918/prrk/common_liberal.htm) doubt read much like won’t read book I’m plenty read subject dictatorship proletariat. sit pseudo-intellectual garbage like rest anarchists put head actual reading.']"
3	137	3_ukraine_russia_russian_ukrainian	['ukraine', 'russia', 'russian', 'ukrainian', 'nato', 'war', 'russians', 'weapons', 'invasion', 'military']	"['appreciate these: cyber cat-and-mouse game ensued, United States, Britain allies helping shore Ukrainian computers stave Russian intrusions. Feb. 23, hours invasion began, Sandworm took another swing, launching malware infected several hundred Ukrainian government computers, officials said. intrusion detected quickly, damage contained. Sandworm struck again. code used looked like thrown together last minute, programming errors — another fail. Sandworm wasn’t done. boldest stroke yet, went Ukrainian military’s satellite communications, used soldiers field. worked, 6:15 a.m. Feb. 24, system went down, right Ukraine’s vulnerable moment. could crippling blow. Ukrainian government backup plan: separate satellite communications system, tested two months before, make sure ready event Russian invasion. ... Ukrainian law enforcement officials started noticing something else suspicious well: spike foreign cellphone numbers near border, forests Ukraine Belarus. Russian soldiers using cellphones call home, suddenly popping Ukrainian networks. Officials monitor traffic peacetime criminal activity quickly realized could see hear invaders approaching real time. “We listened Russian soldiers panicked called friends relatives,” said official oversees phone intercepts. “They used ordinary phones make decisions moves.” long corridors guarded locks facial detection, behind doors sealed wax detect intruders, teams women tracked Russian troops small listening booths friends relatives grabbed rifles patrol streets. “We understood enemy was, numbers using,” official said. eavesdroppers passed details Ukraine’s armed forces carry ambushes counterattacks. Maj. Gen. Kyrylo Budanov, head Ukraine’s military intelligence, said Ukrainian forces used cellphone signals even TikTok videos target unit Chechen soldiers known Kadyrovtsy, named strongman leader Chechnya, Ramzan Kadyrov. took 40 minutes time one video uploaded pinpoint unit’s location near Hostomel airport northwest Kyiv, Mr. Budanov said. Ukrainian military hit three Tochka-U ballistic missiles, said. Russians kept closing Kyiv, forcing eavesdroppers tucked listening rooms make quick decision: destroy equipment flee safety, hang continue gathering intelligence. stayed. “We didn’t lose Ukraine. didn’t let enemy move further,” official said. “On first days, made foolish mistakes, used foolish mistakes advantage.”', ""long Russian soldiers Ukraine, killing Ukrainian school children, can't blame Ukraine pissed Russia separatists. fact Russians fighting side Ukraine belies anti-Russian bullshit. [https://www.newsweek.com/russians-fighting-ukraine-war-destroy-vladimir-putin-freedom-russia-legion-1755102](https://www.newsweek.com/russians-fighting-ukraine-war-destroy-vladimir-putin-freedom-russia-legion-1755102)"", 'El Paso embroiled separatist movement 8 years yeah really problem it, especially allowing El Paso independent meant loss hundreds billions dollars, hundreds thousands lives, massive damage US infrastructure, decades spanning crippled economy. Donbas Eastern Ukraine always contested area, even original elections areas went Ukraine margins narrow US would held special elections many areas. Let\'s pretend areas rest Ukraine, Putin ever voiced interest area outside hotly contested areas, people areas blame Ukraine war Russians. even read Russian sources, financial times conducted interviews Bakhmut even Ukrainian military area said common sentiment area. Let\'s also forget Zelensky ran platform making peace Russians ran platform proceeded opposite due pressure West. record believe NATO troops Ukraine Ukraine full Nazis, believe areas Ukraine wanted independence long time, fought independence long time, Ukraine really care much areas since conducted shelling operations areas day Russian invasion violation Minsk accords. dictators today support, Egypt? Saudi Arabia? Alegeria? Afghanistan (hardly democracy, run warlord fell apart)? quite oppressive regimes dictatorships fund. Belt Road initiative, exactly increasing military budget going help solve that? going start bombing countries Chinese funded infrastructure projects? though Chinese government sending military places, using money deals gain exercise power, that\'s something stop guns missiles. can\'t send soldiers country\'s port say ""we now"", we\'d look like thugs that\'s exactly would be. Yes Russia making friends Iran Syria. hell else expect do? cut rest world. create enemies attempts ""spreading democracy"" code ""we want people charge friends with"" cry panic fails countries like make friends countries made enemies of. reason Iranians like us that\'s regime change 40\'s, Syrians like us reason. Yes, NYC resident native I\'m well aware 9/11, government exercised competency never would happened, preventable tragedy. whole war terror, aka America\'s pissing contest Islamofascists, make people side Islamofascists family killed drone attack lose sympathy may Americans died WTC. Also, supporting Taliban, Al-Queda, ISIS, groups attacked US???? US. CREATE PROBLEMS. interventionism inevitably fails back losing causes, increase resentment towards us, takeaway next time intervene harder. chasing illusion every country dislike like Nazi Germany win create functional liberal democracy like there. think overestimate Ukraine misunderstand Russian strategy, blitzing quickly may original strategy ever since April new strategy war attrition, camp positions, abandon areas defendable, wait Ukraine working. Ukraine running weapons, new ones getting although advanced cannot maintained Ukraine sent Germany repairs (as people know fix cannot Ukraine Russians would treat act war) stress already overworked supply lines Ukraine. 100 billion dollars spent really say caused 100 billion damages Russian military prevented 100 Billion dollars damages country? Ukraine\'s energy grid crapper, brink starving freezing winter, victory looks like? worth it? also think overestimate effect sanctions Russia underestimate undeniably worse effect West. Europe going energy crisis, fertilizer increased cost substantially, food shortages across world. also permanently ensured Russia never rejoin global financial system matter power animosity created ceasing assets Russian civilians abroad. Russia china creating financial system use new friends middle east trade oil, massive blow dollar. love America, love country, love people, love constitution. love insane approach foreign policy indifference towards horrors wars cause escalate. stayed political conflicts countries understand focused efforts development improving country problems.']"
