Topic	Count	Name	Representation	Representative_Docs
71	26	71_game_f2p_games_league	['game', 'f2p', 'games', 'league', 'play', 'model', 'transition', 'rocket', 'battle', 'overwatch']	"[""essentially saying something work except does. game/series need maintain peak popularity order considered successful. merely needs generate enough cash maintain life. honestly believe games like Destiny would continue stick around Bungie changed business model game? games die eventually. Whether there's something unique certain title series matter: point transitioning free play necessarily kill game. done correctly, likely extends life."", 'I’d argue contrary. Destiny 2’s player base dwindling last checked though might’ve jumped back due recent expansion. Evolve didn’t live month Stage 2. reason games lasted longer fill niche market non-obstructive intrusive monetisation practices. Rocket League first car-based football game, it’s free play people support game paying cosmetics. Fortnite uniquely styled, child friendly Battle Royale much potential memes entirely possible play without spending penny, obscene amount entertaining emotes character models. Warzone basically COD Battle Royale. slightly different promotes core game providing core gameplay different environment. also funded battle pass game store.', 'Sure, Genshin transition. see transition would necessarily involve kind corruption ""killing off"" something. New regions, additional story, extra characters added regularly without removing invalidating previous content. think issue expressing game developers finding game unmarketable often turn F2P cash grab. Instead making game remove already use rest bait. result unsatisfying, hollow experience requires often exorbitant payment complete. problem F2P model even transition F2P, problem rooted game developers without money inclination create new content sell. would see rot decided cash grab via subscriptions expansion pack model.']"
72	26	72_speech_free_twitters_twitter	['speech', 'free', 'twitters', 'twitter', 'care', 'private', 'speaxh', 'speach', 'dont', 'cared']	"[""people's free speech starts scaring away advertisers Twitter loses money result? twitter obligation shareholders lose money? Twitter forced lose money name free speech? Twitter beholden shareholders whatever power enforcing free speech rules? regulating body decides hold maintaining free speech standards, body responsible money lost result?"", 'Free speech fine. Stupid speech gets shit on.', 'You’re missing point. bought Twitter ‘we care free speahx’ started banning people ‘twitters private company’ disagree every libs wants. point hypocrisy. It’s never free speech. It’s dunking political enemy’s free speech politics. I’d that’s want fine don’t spend weeks saying much care free speech know that’s .']"
73	25	73_veganism_meat_vegan_philosophy	['veganism', 'meat', 'vegan', 'philosophy', 'eat', 'disagree', 'vegans', 'diet', 'animal', 'dietary']	"['feel like veganism doesn’t consider neurodivergent people food sensitivity issues would make vegan food hard eat. people also struggle nutrition issues might able tolerate kind diet. agree majority us definitely reduce meat consumption it’s important remember evolved meat diet. Also, you’re vegan buy car dependency suburbia you’re hypocrite.', ""different football, think, core value veganism morals it, diet consequence philosophy. philosophy disagree with. simply interest like sport. misunderstand veganism, simply dietary choice? cmiiw. edit: sure, idea impact directly, mean can't disagree it. example, nazism, well, fascism general really concern directly, yet still disagree idea, least know it. definitely know lot fascism compared general population, even know enough compared expert."", 'veganism means someone eat meat. think tells anything that. may IBS/chrons, situation making plain diet vegetables healthiest way live. may religious, adhering culture. may live country livestock less common, luxury, whereas anyone small allotment grow produce. Veganism _only_ dietary choice, reason making choice may different everyone. I\'d understand view ""philosophy veganism"" actually order discuss is. think there\'s overall philosophy covers reasons choosing eat flesh. specific philosophy disagree with?']"
74	25	74_silver_price_dollars_7200	['silver', 'price', 'dollars', '7200', 'buy', 'sold', 'bankbacked', 'canadasince', '4450', '400ks']	"['Holy cow literally 3 times price ad free version NBA League Pass season lasts half long', ""buy professional sports team? hinted wanted buy ManU. would've much better bargain price wise."", 'think $4,450 way low. person paying silver dollars still legal tender, would $7,200. got figures JM Bullion selling cull silver dollars $36 times 200 silver dollars equals $7,200. Crazy, huh??? agree stuff though.']"
75	25	75_man_fuck_fucking_care	['man', 'fuck', 'fucking', 'care', 'shit', 'fuckn', 'spez', 'whatre', 'fren', 'worry']	"[""I'm fucking sorry dude. Fuck."", 'Fuck man. Im sorry.', 'People care man. fucking care man.']"
76	25	76_ich_spanish_dir_grassy	['ich', 'spanish', 'dir', 'grassy', 'dua', 'lipa', 'bueno', 'vor', 'como', 'die']	['problem bueno grassy ass, count five, Spanish extend much that.', 'Speaking english german nonchalantly toss bueno, grassy ass, easy words know. confuses them. double digit know 10. Thats high count spanish.', '*Ich schlage dir deine verdammten Zähne aus. Die Dinge, die ich mit dir machen würde, wenn ich die Chance hätte. Wochen des Schmerzes vor deinem endgültigen schrecklichen Tod! Ich werde dir beibringen, wer die Herrenrasse ist!*']
77	24	77_stalin_soviets_army_hitler	['stalin', 'soviets', 'army', 'hitler', 'comrade', 'ah', 'polish', 'mama', 'communist', 'german']	['dumb dumb dodo would liken Stalin Nazi. You’d speaking German probably concentration camped Red Army hadn’t shed blood ungrateful ass. Keep yapping nonsense Internet - you’ll keep getting intellectual teeth kicked facts actually easily debunked lies. Oh well least mama go home', 'Stalin Soviets defeated Nazis. missed history class think.', 'Let ask something? still live home parents? Stalin went Britain first aid, France, US - said “fuck Commie”. Stalin knew gearing war hero’s (the Fuhrer) homeland, Molotov Ribbentrop PACT (note: claim alliance) meant prevent aggression either side. Hitler invaded France Poland, became clear Soviets Hitler Germans probably going keep word. Polish government going hiding abandoning people, Soviets understood ground defend. Go cry pillow juice box.']
78	23	78_blame_fault_blaming_victim	['blame', 'fault', 'blaming', 'victim', 'responsibility', 'deceived', 'roofied', 'gut', 'accountability', 'cop']	"['comment understood meant accountability! Yes totally people saying ""it ___\'s fault made decision"". yes, kinda like people peak high school / college. deserve △ bad friend choosing let figure say anything. Maybe could influenced back plan. Maybe could minimized regret. let assumptions guide decisions others since never decision make.', 'blame?', 'victim blaming, common sense. make less victim, fault careful']"
79	23	79_homosexuality_gay_natural_nature	['homosexuality', 'gay', 'natural', 'nature', 'sexual', 'gene', 'girl', 'drag', 'define', 'female']	"['dont care bed, dont see homosexuality could define natural. r arguments? nature intended reproduction male female sexual organs.', ""I've always considered hormonal imbalances possible factor homosexuality ideations transitioning, males lower base levels testosterone, females lower base levels estrogen progesterone. Might correlate pheromone attraction altering reversing, think study wished prove disprove idea would never make funding-stage lol"", 'sexual gratification dominance behavior homosexuality some1 saying homosexuality isnt natural. defines natural occurring conformity ordinary course nature... nature wants reproduce. maybe find another way define natural would include homosexuality valid counter argument']"
80	23	80_evidence_sizeable_verifiable_asking	['evidence', 'sizeable', 'verifiable', 'asking', 'sources', 'fact', 'provide', 'claim', 'provided', 'cyrus']	"[""There's evidence even happened."", 'presented single fact. Facts backed evidence evidence support claim US needs weapons we’d run 10 months. However, evidence, means post discuss it. Otherwise opinions nothing more.', 'Evidence implied, supporting arguments based logic evidence. People like ask evidence want study nothing value offer conversation know evidence means.']"
81	22	81_foster_adopted_mothers_parents	['foster', 'adopted', 'mothers', 'parents', 'kids', 'children', 'care', 'baby', 'lafayette', 'singlemothers']	"['boss, hold up. ever foster care? know what’s it’s like bounced around stranger stranger, knowing real mom dad don’t love you’ll probably never adopted genuinely loving family? Adoption happens, adopted kids still find they’re different problems compared kids born loving families they’re wanted. You’re touch reality it’s even real. You’re delusional man enough raise child, please don’t reproduce. Ever.', 'Let’s pretend link horrific grammar lack understanding real world. understand single mothers result father leaving, right? Mothers aren’t choosing single, fathers choosing leave. Single mothers best. aren’t bad parents fathers choose leave. suggesting post-birth abortions? statistics result disadvantages living single-parent household, single mothers inherently bad parenting. also highly doubt numbers considering found website dedicated terminating child-support. [Your “source”](https://www.fixfamilycourts.com/single-mother-home-statistics/) also important note cases article cites predominantly based black communities higher crime rates higher rates single-mothers begin with. nuanced topic, obviously two-parent household preferable, that’s really option many cases. It’s idiotic state single-mothers default bad parents. flimsy statistics don’t back well.', ""foster care system something people came specifically orphanages awful. idea bad were? [Here, learn consequences aggressive pro-natalist policies.](https://www.studysmarter.us/explanations/psychology/basic-psychology/romanian-orphan-studies/) actually know well happens foster care system, literally went kid. good foster parents, bad ones, everything between. That's difference. Foster homes potential good (and often are, experience) orphanages potential all. Even staffed best possible people, usually happens, still terrible kids structured. Fetuses people yet. conscious, fully developed, can't survive outside womb. inconvenient. also bad kids parents want them, women's body growing ultimately decide happens it. Anyways, answer this:""]"
82	22	82_desantis_florida_trump_nomination	['desantis', 'florida', 'trump', 'nomination', 'wants', 'charisma', 'win', '2024', 'republican', 'personality']	"['Im regular conversation heard “Florida’s economy insane jobs moving desantis”… average idiot seeded Desantis=good… really don’t high hopes country 2022 midterms, there’s chance enough morons died covid prevent us desantis theocracy', 'kind assumed too, till saw Florida near DeSantis. Jeez, night day. DeSantis charisma all.', ""pretty clear point Trump DeSantis top Republican candidates 2024. two them, DeSantis win nomination. hand, anti-Trump Republicans pile on, Trump likely path victory, core support undoubtedly stronger DeSantis' even everyone else wishes he'd go away.""]"
83	21	83_coercion_violence_hierarchy_anarchism	['coercion', 'violence', 'hierarchy', 'anarchism', 'authority', 'anarchy', 'anarchists', 'coercive', 'threat', 'physical']	"['ok not? simply stating u give reason not. want know age contextualize discussions u r batshit insane actively avoiding truth. control maintain literally physical security order might coercively prevent anyone would otherwise take control. bank physical security, banks utilize threat coercion maintain control. that\'s one major feature bank ... fact specializes maintaining control assets via coercion outside threats. mean, bank physical security, ""took"" assets ... could walk take back. reason can\'t physical coercion would use prevent you. government lawsuits asset seizure exist worldview they? u simply acknowledge them, exist, eh? see, understand ideology plays part. deviants ideology met coercion, that\'s fundamental part hierarchy enacting authority. convinced otherwise cause u simply ignore coercive factors like said many times - want beating nazis consistent anarchy, acknowledging connection hierarchy coercion would destroy that. can\'t even admit hierarchy typically involves coercion. coercive means application force threat thereof. that\'s definition. saying ""systematically coercive"" implying systematic application force threat thereof. that\'s imply, use different word.', ""I'm dishonest violent. would dishonest lied. give people personal information internet. implies hierarchy us not. sort connection conversation. Insults substance since irrelevant. No, literally control account. account vault deposit money. legal fiction exists insofar government ensures exists and, legal fiction, plays government's rules. Even walked withdrew money dodging taxes, account would still frozen would still interest applied it. able go bank majority financial transactions need to. heavily impedes mobility society. suddenly unable access majority activities institutions rely institutions activities utilize banks way. comply recognize bank legitimate means goes business. one right mind keep money there, one invest, it'll get shut means one could invest keep money even wanted to. reason comply charge banks directly benefit things moving smoothly possible continued obedience authority. know dependency upon government existence. core, ideology. Ideology turns practices reinforce other. inherent interdependency human beings gives hierarchy power. violence force. physically coercive. Yes. Physical coercion need fundamental hierarchy order exist. That's fiction broken, drug-riddled brain produced. They're systematically coercive but, like said before, need voluntary obedience day-to-day level continued maintenance hierarchy. that's anarchists oppose *all* hierarchies, including voluntary ones. anarchist. oppose *hierarchy* violence. distinction me. anarchist. see utility opposing hierarchy violence. Even systematically coercion, long physical coercion fine. daft notion. narrow-minded dogmatic adherence idea force authority that, wasn't, fine it."", 'I\'m giving personal information. Also that\'s relatively young. fucked up? go, nothing substance behind words. dogma. successful point hierarchy reinforces interlocking social practices. human beings interdependent social activity relies social activity. such, social activity organized particular way, organization strengthened shared institutions practices others. makes opposing hierarchy difficult. Coincidentally, social activity organized anarchically, opposing anarchy would difficult. That\'s anarchy defends itself. Yet explain came first. And, unlike chicken egg problem, way explaining violence could first used capacity use it. non-argument. one arguing violence equipment exist, I\'m asking could violence used first place equipment use it? need lots social support produce anything resembling military, ""they used military"" explanation social support obtained. militaries exist without social support first place. way, doubling admitting logic circular hilarious. fact think nothing wrong circular logic even hilarious. government force pay taxes. consequence paying taxes government taking money bank account, putting interest it, freezing assets. words, use authority banks financial institutions fuck over. use violence you. closest would come using violence appropriating assets last resort happen unless committed massive tax fraud. mention that\'s consequences taxation are. fucking 32 even know happens pay taxes? necessary all. Also already have. arguments thus far either been: ""People obey authority same/extensions authorities"" ""Circular logic"" laughable I\'ve already dismissed them. arguments made depend literal 5 year old understandings government works. specifically, 5 year old would understand government taught American libertarian. amount physical coercion could last long enough actually cause indoctrination. Physical coercion, like direct physical coercion, absolutely unstable last long period. even form organization threat must constantly opening rebellion (which almost always is). Hierarchies based around physical coercion. established physical coercion. claims continue fail defend. way dealing basic fact people ordered use violence physically coerced. basic observation something incapable addressing. alone showcases stupidity ideas. I\'m one asserting hierarchy established maintained interconnected mutually dependent groups institutions. I\'ve systematic perspective entire time. stumbled onto vaguely ""systematic"" perspective sheer goalpost moving. have. military, capitalism, government, patriarchy, etc. sometimes force used people live part social hierarchies mean coercion fundamental part it. logic, eating oranges fundamental part police officer police officers eat oranges. equivalent ""drinking water bad Hitler it"" drinking water fundamental part Hitler\'s character. We\'re redefining ""chaos"", we\'re extending recontextualizing means. Anarchy absence authority, actually means time, people take mean chaos be. quit fucking idiot zero critical thinking skills start actually learning read.']"
84	21	84_trump_imo_furthering_adjacent	['trump', 'imo', 'furthering', 'adjacent', 'slime', 'yesterdays', 'dead', 'sell', 'hes', 'day']	"['Yeah dunno. He’s another state governor. follow politics closely wouldn’t recognize photo him. He’s quiet kinda inside baseball personality IMO', ""thinks we'll miss him? lol Or, worst case scenario, he'll sell Trump (did Jared discuss earlier today?)"", ""loyalty trump, care furthering cause. requires abandoning trump they'll throw like yesterday's newspaper.""]"
85	21	85_thought_think_uh_cakewalk	['thought', 'think', 'uh', 'cakewalk', 'brainrot', 'poobah', 'relieve', 'poobix', 'ponderoushttpswwwyoutubecomwatchvrv7wf5vvwuo', 'platitude']	"['Never really thought way. Makes sense. Sorta “triple dog dare ya”', 'Uh guess that\'s fair enough. ""If think likely"" then. said, bottom statement platitude. ""It\'s one thing car, quite another drive somewhere."" Duh.', ""think he's looking out. wanted grand poobah feel like champion freedom. realized shit's hard cakewalk thought would""]"
86	21	86_cancer_chemo_treatment_improve	['cancer', 'chemo', 'treatment', 'improve', 'stage', 'heal', 'goal', 'cured', 'creator', '10']	"['That\'s kind like saying ""don\'t complacent maintenance chemo, seek cure Stage 4 cancer!"" Yeah duh that\'s goal always possible.', 'Well, no. don’t expect someone cured instant, improvement 10+ years issue. would like keeping chemo going 10 years still amount cancer. point, change treatment little', 'lots people research world cancer. far better cancer research done one place one group people. explain further?']"
87	20	87_disabled_hostile_left_deny	['disabled', 'hostile', 'left', 'deny', 'leftist', 'policies', 'rightwing', 'leftists', 'politics', 'rightwingers']	"[""thought R word got people cancelled right-wingers mad that? Lol I'd like meet nice tolerant right-wingers. find them? can't deny conservative policies hostile disabled people."", 'im serious, bunch nerds mostly(at least friends are) anecdotal experience left nasty people. ""You can\'t deny conservative policies hostile disabled people."" cant deny democrat policies hostile poor people(well actually everyone economically)', ""stated, doubt considered left winger align common goals purposes. get talking Diane Sare anyone close LaRouche different saying consider well. plan buy Silk Road book Schiller Institute website alignments left wingers issues day. Even then, there's things longer follow. know issues man really see was. there's certainly connections targets elimination Black Panthers, socialists (Eugene V Debs), others opponents outsiders can't deny.""]"
88	20	88_food_fish_takeaways_clap	['food', 'fish', 'takeaways', 'clap', 'organic', 'farm', 'supply', 'cook', 'savaloy', 'gurnard']	"['Clap... clap... clap... course not. know average low income/beneficiary mum know that. Like said net producer food, feed 40 million people people country go hungry? cook cheap $3 plate (vegetarian Dahl) cook slightly fancy $5 (last weekend leg Lamb). Supermarkets better needs reigning believe going make much difference all. People still eat takeaways Savaloy soup.', ""I've already said that. Focus meat veg source plate. Look whole supply chain. turnover, lot Supermarkets sell shit food. biggest complaint hear 'it's cheaper eat takeaways'. government wants people healthy focus making good, healthy, wholesome food reasonable price priority. one eating Savaloy Soup."", 'kind look supply chain issues, thats point Market Studies. could expanded it, think better look individual parts rather whole thing. Trying look farming side processer side supermarket side, thats complex. already takes 18 months get one study done, long think would take kind analysis talking about? Cause buying snapper, demand fish around? Simple supply demand. get better tasting fish, like gurnard, half price. saw gurnard local Pak N Save $20/kg last week. buy imported fish Thailand $9/kg. Theres lot different issues food supplies, really many good options wholly change market.']"
89	20	89_porn_nudity_depicting_acts	['porn', 'nudity', 'depicting', 'acts', 'nanny', 'booze', 'internet', 'rot', 'societal', 'account']	"['Children free access porn serious issue.', ""Nudity distinct porn. Medical illustrations, works art depicting nudity porn depicting sex acts. pretty sure would porn photo video real person's nudity, depicting sex acts, art intentionally drawn way intended arouse viewer. Michelangelo's David porn arousing way picture woman undressing provocative manner is."", 'porn free']"
90	20	90_fascist_fascism_fascists_incredibly	['fascist', 'fascism', 'fascists', 'incredibly', 'authoritarian', 'thibk', 'strong', 'weak', 'enemy', 'ruthless']	"[""Well disagree. Yes us authoritarian pronoting anti communist agenda world, also alawys democracy. Also fascist means ultranationalist strong man uniting nation fight 'wrong' thing (thats ccp doing), never true america, although nowadayas conservatuce party ia exactky that. Idk man thibk travelled way done ideological rabbithole thibk america china equally bad actors."", 'fascist every authoritarian happen dislike disagree with. objectives eventually form government same. accepted military aid actual fascist governments later refused ally assist war. True brutal ruthless called equally brutal totally depraved enemy. sides horrible things judging Spain today less awful side won.', 'Good old fascism paradox. Since enemy must incredibly strong (so overwhelming force faced thus justify position current unchallenged authority) incredibly weak (so legitimate holder power thus worthy overthrown) time, also requires fascist supporter population incredibly strong (so able win prospective conflicts minimal losses ready overthrow enemy power structure drop hat) incredibly weak (so held paradoxically weak opposition time need strongman leader triumph behalf) time. enough cognitive dissonance make brains melt.']"
91	20	91_life_struggle_empathy_whove	['life', 'struggle', 'empathy', 'whove', 'hardship', 'suffering', 'lives', 'trauma', 'kind', 'advice']	"['feel way. wasted time. dwell it, even one second, you’re supporting want become. measel. Go get mind body right. research. man woman change state world live in. still live America. expose corruption commune together chance revolutionize future children (and you’re new beautiful lover eventually find stop lil girl)', ""think kind weird obsession struggle life. kind hardship struggle gives lives meaning, know fuck there's personal hardship crisis? Fuck know."", ""falling it? truth nerds can't maintain relationship? type depressed doomers afraid guns worried hero? Man Woman fuck last 3.5 billion years uninterrupted ancestors led fucking justice. respect anything yourself? struggle life good, kids struggle, interesting life.""]"
92	19	92_news_reuters_fox_negative	['news', 'reuters', 'fox', 'negative', 'hours', 'story', 'journalists', 'breaking', 'exhaustive', 'morbid']	"['referred news, almost always negative manner. That’s different constant news coverage 2016-2021 would fawn every stupid sentence. can’t recall seeing actual video talking since left office it’s great.', ""Yep, see double standard all, especially live fact-based world. probably watch 5 10 hours Fox News week, choice, morbid curiosity. I'm sure exactly make article, last months they've neutral negative regarding Trump."", 'Trying beat actual journalists ""breaking news"" via viral videos going leave unquestionably exposed fake news misinformation. much better without twitter reading AP.']"
