Topic	Count	Name	Representation	Representative_Docs
13	80	13_guns_gun_laws_alcohol	['guns', 'gun', 'laws', 'alcohol', 'unethical', 'firearms', 'law', 'standard', 'youre', 'mass']	['Nope. clarified many times wording wrong. explaining reason, asserting whether it’s right wrong. already said shouldn’t used words “should punished” rather “are punished”. That’s meant made clear misspoke. Nope. I’ve addressed many times I’ll address again. It’s unethical people shouldn’t allowed dangerous killing machines caused mass murders don’t need. Nope again. already explained misspoke clarified first example (that’s making anything up). Also, saying unethical laws changed new standard. It’s existing standard. Look laws history reformed. Ask anyone common sense. go shooting range target practice. need guns home Ask families victims school shootings gun massacres occurred America. give many examples mass murders caused guns give “mass murders” caused alcohol. people use guns alcohol war cause damage? America laughing stock countries amount shootings happen here, fact people like ignore glaring evidence guns harmful protect. studies literally show people like “knowledge deficit” statistics regarding guns, live denial. can’t cause mass murder alcohol, cause guns. since keep mentioning Carrollton bus collision, already said laws drunk driving prevent that. matter laws make, people violate laws. making laws cuts frequency people harmful things. 1) ones forcing go near pitbull 2) There’s plenty options eat meat, don’t need elk, 3) go shooting range borrow gun. alternatives uses guns. don’t need one unless want hurt others. Give statistics many grandmas absolutely needed gun protect things like knives, hammers, police, etc available already existed. added didn’t common sense understand already. Like fact guns sentient like people. cause add something doesn’t mean didn’t already exist. someone walks room, mean didn’t exist entering room? Lmaoooooooo, desperate you’re literally making something never said 😂? you’re one accusing making stuff up. Yes did, that’s lot laws reformed lmao. Like laws ban slavery promote equal rights. unless want deny history majority people say, I’m making anything already explained multiple times misspoke first quote you’re desperate win keep ignoring that, that’s buddy. Putting words mouth see. Give proof said that. I’m advocating getting rid guns, people them, enforced without hurting people. Let jog memory guns protect people. Oh wait that’s right. hurting people explosives illegal. Like said above, give statistics often that’s necessary Yep guns also increase homicides mass murders, suicide. inherently dangerous. alcohol dangerous guns, can’t people use alcohol instead guns wars? everclear type alcohol people consume? never said guns shouldn’t used war, I’ve referring domestic ownership. Also, since gun, don’t go liberate Ukraine?', 'Nope, I’ve said countless times law unethical, changed, enforcing law would also unethical. Look previous comments don’t believe me. Yep, comparing holocaust. think something like holocaust happened america people violating gun laws, deluded. There’s lot things need survive daily basis. you’re saying objectively false. Yep, did. said wanting kill people fun guns sadistic immoral. alcohol. Seems like lack ability pay attention. Guns killing machines, alcohol isn’t. Guns used hurt people. want target practice, use paintball guns. There’s need actual guns. It’s illegal bomb danger pose society. There. Didn’t talk earth, talking me. lack reading comprehension skills seems. Nope, standard prohibiting things designed lethal/cause mass murders needed. I’m changing standards. Protecting humans sentient beings standard ethical/legislative discussions. bring clear lacked critical thinking skills realize guns can’t compared humans body parts. born gun attached body? That’s right, weren’t. Making guns illegal drastically lower people’s ability obtain guns. people break law? Sure. they’ll punished. again, eyeballs aren’t dangerous part people’s bodies own. Guns aren’t necessarily. Guns laws enforced closing stores sell guns, imprisoning/fining people guns, etc. shooting involved scenarios. SWAT raids one option used necessary Again, mentioned many times, it’s fault don’t reading comprehension skills. It’s responsibility punished someone’s else’s actions. I’ve said multiple times alcohol isn’t killing anyone unless it’s abused. Guns inherently killing machines. *only* used hurt. Again, I’ve said multiple times alcohol moderation minimal health risks. people drink alcohol fine. Anyone uses gun people hurt people. need them? already said could go shooting range use paintball guns target practice. need them. Alcohol killing machine it’s used hurt others it’s fine trust people home. doesn’t apply guns Guns machines people inflict mass murders. seems like lack basic common sense well. People also laws forbid people driving drunk. people unfortunately break laws, way people break laws Think again. I’ve never said anything things. said countless times laws could unethical so, changed. gun laws aren’t. haven’t given one good reason guns laws would unethical wasn’t able refute. I’ve lost track many times I’ve said that. gave two examples message. Owning explosives driving drunk. illegal unsafe. Also, don’t magically make new standards. bring relevant ones ignore cannot applied guns. Like example, guns sentient beings like humans. can’t apply guns laws humans.', 'clarified meant long time ago clearly misspoke. said response saying people violating gun laws thrown jail reduce suicides. responded saying thrown jail violated law. Go back comment don’t believe me. mistake using word “should” instead word “are”. clarified meaning. also clarified punishment violating laws occurs that’s laws fundamentally work. didn’t, one would follow laws. that, also made clear law unethical, reformed enforcing would unethical. something legal doesn’t mean it’s ethical. didn’t make new standards. quite literally common sense anyone common sense would agree me. No, brought fundamental differences guns alcohol makes analogy invalid. case don’t know analogies work, comparison valid 1) Alcohol something people consume fun, used moderation, minimal health risks. isn’t normally used hurt people doesn’t cause mass murder. examples brought driving accidents examples alcohol illegal: can’t drive drunk. 2) Guns dangerous killing machines ability cause mass murders. give long list examples schools shootings people using guns mass murder people. use unless want hurt people. want target practice, use paintball guns, fake guns, go shooting range use gun target practice. want protect yourself, use knives, hammers, household object. didn’t create standards. Multiple standards already exist brought discussion refute absurd claims making. example, said people killed aren’t needed like guns. said people sentient beings, guns. objective fact, random standard made up. Another example: said law unethical, changed. Again, didn’t make new standard. Ask anyone agree me. brought conversation refute claims. didn’t make up. It’s funny one saying that, person compared getting rid guns getting rid people (who sentient living beings, objects like guns) person compared enforcing gun laws holocaust (which one biggest atrocities committed history). never said person protected gun. said literal studies prove guns harm protect. Saying ownership explosives illegal psychotic, it’s law good reason. extremely dangerous. also gave many options fulfill purpose guns, there’s need guns. Nope. Drunk driving one scenario alcohol harmful that’s laws it. Alcohol otherwise used moderation minimal health risks. Guns inherently dangerous lethal. I’ve given alternatives uses guns, there’s need something dangerous. What’s alternative drinking alcohol would produce effect causes people enjoy alcohol?']
14	74	14_church_catholic_vatican_jesus	['church', 'catholic', 'vatican', 'jesus', 'catholics', 'christ', 'pope', 'christian', 'christians', 'religions']	"['spicy conspiracy sub like before. good ol fashioned belief catholic church controls everything. questions: majority world catholic? fit catholics controlling everything? even US, catholics even dominant christian faith, let alone majority population. fit? get sucked nick cage movies?', 'Good thing Jesus Catholic', 'even mean? raised catholic got confirmed etc, never gave shit, never went church turned 18, way ""still church."" mom died asked catholic (her funeral catholic church grew in) said moved on. Contrast LDS church stalks life lawyer tell back fuck up.']"
15	64	15_therapy_mental_therapist_improvement	['therapy', 'mental', 'therapist', 'improvement', 'depression', 'health', 'depressed', '10', 'normal', 'seek']	['somewhat agree mind must maintained like body. However, therapy isn’t like working it’s like chemo. Friends, hobbies, etc continual things need maintain minds. Therapy, hand, happens mentality pushed dangerous bounds. Ultimately, therapy end goal. think therapy goal mentally healthy enough longer need therapy.', 'Hmm… think misunderstanding argument, probably didn’t clarify nuance enough. truth situations call different things. think, however, growth result therapy. see people therapy 10+ years started. therapy while, improving that’s fine. don’t think 10 years hardline, past point seems like something especially wrong… either situation therapy', 'don’t think daily stresses life cause someone continually needing therapy. Therapy, core, normal. depressed anxious extreme cases disease own, seeking fix issue. need therapy, seek it. However, normal. Keep mind say something normal doesn’t mean it’s bad. Chemo isn’t normal, it’s good. Therapy isn’t normal, it’s good. However, seek therapy means end, end']
16	63	16_science_evolution_experts_scientists	['science', 'evolution', 'experts', 'scientists', 'consensus', 'scientific', 'expert', 'subject', 'data', 'biologists']	"[""deny truth. i;m saying UNLY evolutionary biologists could invoked saying scientists agree evolution. falsehood evolutionists anyone helping saying SCIENTISTS agree evolution biologist scientists agree etc. distorting science scholarship thier gain. follows evolutionary biologists would agree evolution far relative card carrying scientists world. matter think contention them. Creationists point scientific community opinion evolution irrelevant invoking scientists special think. Nope. think expert paid money. bad guys misusing scientists thier cause can't make case."", 'That’s asked you. deny truth? what, like 800,000 people? No. United States population, United States, accepts biological evolution vast majority people know science support well. Almost 50% anti-evolution creationists **also** know scientific consensus biological evolution happens described theory know consensus backed ass ton evidence, observations, confirmed predictions could it’s true. 50% deny truth? don’t 50% know truth even is? percentages different countries become even less favor position. evidence shows, 99.75% 99.84% biologists accept current theory biological evolution accurate description observed phenomenon biological evolution. already tiny percent remains, ~355 people so, people also know phenomenon biological evolution occurs it’s roughly percentage. one two people remain fake degrees ordered online degrees all. would fallacy use consensus evidence consensus true. It’s okay point consensus exists, ***but*** it’s genetics, fossils, direct observations evolution action, etc indicate theory, consensus, close “Truth” currently possible be. **If** disagree need provide ***evidence*** theory. might also help, though it’s necessary, could explain consensus first place. Denying consensus makes look dumb. Invoking conspiracy theory makes sound insane. ~800,000 people? sure are. names Nathaniel Jeanson, Kurt Wise, Todd Wood, Michael Behe, Andrew Snelling, … … … names, Michael Behe “evolutionist” doesn’t even try support YEC invokes “irreducible complexity.”', '***ever*** studied entire life? education biology ever go high school pass bar. couple classes biology college, I’m even close biologist learned. don’t pretend expert, know lot I’m talking lot “creationist experts” pretend to. tells ones actual relevant degrees *lying* knew anything biology you’d notice that. make case. 4 people named Steve “creationist” team even relevant discussion. Three cancer researchers using evolutionary principles don’t seem accept strict adherence purely naturalistic explanation biological evolution- might like Michael Behe invoking God complexity. couldn’t find anything suggest reject evolution entirely, applied science area study based heavily theory, relationships, etc. leaves one “Steve” turns doesn’t science degree all, likes pretend expert books. He’s caught lying outright contradicted numerous occasions. quite literally closest thing scientist comes close agreeing YEC position, except maybe Nathaniel Jeanson Kurt Wise, people know YEC doesn’t stand scrutiny. invoke magic Jeanson contradicts himself. science degree, like almost “creation scientists,” also hasn’t done much way science since around 2010 studying stem cells adults something still getting degree scientist. Biologists actually biology pretty unanimous agreement central theory biology, theory biological evolution, pretty much spot on.']"
17	63	17_tesla_teslas_car_model	['tesla', 'teslas', 'car', 'model', 'bmw', 'quality', 'cars', 'build', 'vehicles', 'rivian']	"['watch videos bad build quality three people actually know Telsla’s (1 M3, 2 MY) don’t see issues inspected car looking sort issues. Tesla range straight line speed better competitors. like R1S yet experience R1T myself. Taycan may good it’s also unbelievably expensive. I’ve test driven E-tron I4 M40 they’re unimpressive (granted drive comfortably 3 air suspensions neither lower model Tesla’s come air suspension). best Tesla alternative I’ve tried far Jaguar I-pace. I’ll see think BYD Atto 3 available locally Tesla still offers best value money.', ""think entirely misses point Tesla sells. Apple car manufacturers, maybe could compare SAAB. Tesla's sell user experience cabin design. automate lot menial tasks like turning windshield wipers turning everything locking leave car. also options automation really can't without specific support it, car pull parking spot own, cooling cabin get back. reason buy luxury car comfort, traditional mindset adding feature car robust, reliable, perfect. Tesla really play rules, provide tons quality life features software updates, think competitors wise start presenting similar offerings. then, people want Teslas features likely capitive market, maybe small non-viable one eventually, specs reliability good user experience make. PS: fair, critique really apply Rivian, also happy push lots half-baked helpful features out, Tesla actually compete price."", 'Everything. Tesla worst build quality interior quality far. compare closest competitors. BMW i4 objectively better almost every way Model 3, aside straight line 0-60. Rivian R1S better Model X aside gull-wing doors (if that’s even better lol). Porsche Taycan Lucid Air significantly better Model S. (Not surprising since Rawlinson left Tesla designing Model make Air).']"
18	63	18_nazi_nazis_hitler_punch	['nazi', 'nazis', 'hitler', 'punch', 'classical', 'jews', 'auschwitz', 'popularized', 'holocaust', 'overton']	"['Wouldnt make everyone nazi ?', 'sounds like something Nazi would say', '""Punch Nazi"" copying tactics, Spencer-era still ""wear suit tie request civil discourse"" arc. punch popularized phrase stood rallying call people gather around, recognize widely Nazis taken lightly need pushed conversation. Richard Spencer Nazi, practical outcome supporting ""Punch Nazi"" actually punching many Nazis. like understand rhetorical effect Bindels writings overt ""call violence"" actually see violence enacted, neither ""Punch Nazi"" serve call actual violence considerable degree.']"
19	61	19_wife_married_family_relationships	['wife', 'married', 'family', 'relationships', 'kids', 'dad', 'uncle', 'parents', 'aunts', 'nephews']	"['wife agree that. Even though people married adult fun whenever, sometimes solo session needed instead.', ""That's share contribution household (finances counterpart's) day age agree take. mix together. SAHM/single income family's inner workings definitely different dual income family. try jumble together get confused. necessarily disagree single income family short term alimony sorts would go long way towards helping SAHP regain independence. current policies way lopsided. make sound like lack understanding agree take completely."", 'wife left']"
20	59	20_biden_obama_president_joe	['biden', 'obama', 'president', 'joe', 'hes', 'trump', 'cognitive', 'decline', 'dementia', 'politician']	"[""I've watched Biden politics 20 years never heard even hint stutter Obama admin. made frequent gaffes embellished personal bio, always average speaker, even maybe especially extemporaneous speeches Senate committee. speech problems kid, got point one ever noticed commented 50 years Washington, speaking problem again, that's explanation problem. anything evidence cognitive decline perfectly capable hiding before, lacks ability."", ""There's logic misrepresenting science. actually pretty fucking gross. truth science behind cognitive decline makes pronouncement cognitive decline becomes likely X age. fact, recent studies strongly suggested lifestyle far stronger determining factor likelihood cognitive decline age. guess what? Biden takes better care overwhelming majority Americans. Basic logic let man, family, medical staff make determinations. edgelords social media clue they're talking about. believe Biden honorable man looking what's best nation. see reason indulge idea others know better Joe inner circle mental capacity is."", 'ok what. gonna happen Joe Biden president.']"
21	57	21_university_college_courses_education	['university', 'college', 'courses', 'education', 'degree', 'students', 'arts', 'tuition', 'universities', 'colleges']	"[""pretty egregious break promise like yeah. However stuff tuition fees UK way complex nuanced that. lot stats suggest change *increased* number students lower income backgrounds go university (maybe maintenance grants living costs people low incomes funded new tuition fees), least, number increased regardless change. Also, like, theoretically always affordable, important understand system works, arguably pretty fair. take loan around £9000 year pay course, interest taken percentage income £27k year, like tax, graduate, 30 years paid rest cancelled. theoretically someone leaves university can't make much money pay much all, service subsidised high earners got high-paying work degrees. Arguably fairer system funding taxpayer, complex. end day, people go university average still make lifetime people don't, including tuition fees years lost work. think system works fine honest, even bit bureaucratic ultimately saddle people debt (that, time, bad debt goes)."", 'that, fixing that, Basic Costs University Education covered Tuition (including Scholarships, University Endowment Funds) State [In Colorado, Pennsylvania, Vermont State Local Funding less 10 Percent Public Colleges Total Revenue](https://i.redd.it/dgpxmhad2pj91.png) states choose different ways go issue * Total operating revenues Pitt Listed $2,352,970,000 Financial statements * Commonwealth appropriation General support Funding $ 151,507,000 Colorado least 10 colleges Colorado, [UC Boulder large market based tuition](https://i.redd.it/km56779x6vj91.jpg) state students pay state students low cost education without state tax payers paying * 14,315 State Students Average Tuition University $35,347 * 21,200 Instate Students Average Tuition University $11,716', 'South Carolina State University University Health Sciences Pharmacy Warner Pacific University Alfred University Allegheny College Bates College Chicago State University Cleveland State University Colby College Cornell College Delaware State University Harrisburg University Science Technology Marymount Manhattan College Metropolitan State University Denver (MSU Denver) Northern Illinois University Pacific University Oregon Texas &amp; University-Commerce University Maine University Michigan-Flint Worcester Polytechnic Institute yes, filter ""No fee international applicants (Non-U.S. Citizens)"" ""Standardized Test Policy: Never required/Flexible""']"
22	56	22_musk_elon_hes_tesla	['musk', 'elon', 'hes', 'tesla', 'gates', 'products', 'billionaire', 'tony', 'vision', 'hypocrite']	"['Musk wants fuck everyone isn’t him.', 'never heard elon musk?', 'really though. He\'s far megalomaniac. guys seriously see ( ""your"" mean prevailing sentiment average liberals collective obviously can\'t speak individually) hate Musk seems correlate leaders taking issue him.When leaders take issue support something media consume get busy indoctrination said perspective. happens repetition affirmation peers subjected narrative. true sides. cannot see inherent bias media flaws leaders well positives opposition safe say compromised influenced, outright manipulated. true people regardless political leanings. reason Cleary case Musk people give see vague reasons dislike him. Truth he\'s bizzare he\'s unique individual, one off,.he\'s highly intelligent certain areas lacks social intelligence. actually extremely common people like him. People talk crap elitist billionaire narcissist megalomaniac. He\'s none things.... well definitely billionaire jet honestly necessity CEO larğge rapidly expanding international company. he\'s ai typical elitist D-bag billionaire. Musk enough money neither family ever need work again. seriously mean never. kids ,grandkids, great grand kids etc. Yet work . tiny home he\'d stay space X launch pad I\'ve heard many talk often sleeping factory floor keep getting things done calls it. He\'s singlehandedly responsible wide adoption Evs. innovations they\'ve made lowers costs significantly. make great products people enjoy last long time. products potential make owner money. make great products marketing department. When\'s last time seen Tesla add dealership? friggin insane, completely unheard large corporate producer product. socially awkward Musk always stirring things causing buzz tweets.Henis Teslas marketing department. fact alone saves company 100s millions year. There\'s also fact understand vision products companies meant integrated. vision future good one too. billionaires like Klaus Schwab Bill Gates claim environment ,in reality aren\'t. Instead control. ideas involve regulations, less freedom us,and control them. got Gates preaching deportation trying get everyone leave rural areas cand consolidate major cities. Conveniently make people easier control. preaches he\'s busy buying much farmland cN get hands on. Gates largest owner farms country. bad thing. mean already bad enough vast majority products grocery store owned handful companies. Imagine handful grow food. Talk power.1😬 Swab preaching great reset saying ""you\'ll nothing happy "" visions future ones us OK significantly less get more. Musk hand vision things future decentralized give power individual rather billionaire buddies Ike Gates Schwab want. Musk care money power. motivation one impact. wants change world significantly meaningful way. Sure could say alone selfish could motivated wanting ro remembered leaving legacy, want that? want know we\'re guys Twitter FB deliberately censoring silencing people order manipulate people voting candidates back. means liberals obviously ones indoctrinated. make mad? Musk released ton files show blatant corruption collision liberal politicians social media. Coincidentally began attacking Musk hardcore. bidding. crazy. obsessed Musk...wait gets things dialed reveals real reason bought Twitter.....it\'s friggin genius benefit us greatly. Yet guys run around parroting concerns hating someone even know whose actions harm whatsoever. Hate want, unsuccessful people do. understand wolf cares opinions sheep. referring Musk rather fact tantamount bunch school hats gossips cyber bullies people really need stop listening others start thinking yourselves.']"
