Topic	Count	Name	Representation	Representative_Docs
36	44	36_trans_gender_identity_woman	['trans', 'gender', 'identity', 'woman', 'sexist', 'women', 'transgender', 'biological', 'pronouns', 'terfs']	"['……little extreme there, one cares trans much media trans care trans….', 'genuinely tried generous (despite repeated antagonism), graduate degree language done research gender/linguistics; can\'t use semicolon correctly save life. idea talking about. pronouns use someone dependent perception gender presentation. [There enormous body research effects gender language \\(and yes -- called linguistic gender\\) influence perceptions people world.](https://www.scientificamerican.com/article/how-language-shapes-thought/). plenty languages gender sexless nouns, use non-gendered pronouns people, contain third (or more) grammatically gendered pronouns, way use pronouns based perception convention. See: ""Psycholinguistic investigations way readers **speakers perceive gender** shown several biases associated gender linguistically realized language"" ([Gygax et al., 2019](https://pubmed.ncbi.nlm.nih.gov/31379661/)) [emphasis added]. Furthermore, well documented natural-gender languages like English, correlation making sex gendered pronouns simply reinforced, ""grammatical gender cultural label concept psychological reality"" ([Samuel et al.](https://link.springer.com/article/10.3758/s13423-019-01652-3)). know gender language influences perception world psychologically, way person perceives place social group concept self well-documented influence well-being mental health. good bad implications, obviously, identification social group important psychological perception world. * ""Gender key determinant self-concept perceptions others. shapes mental health, career paths, intimate relationships"" ([Morgenroth &amp; Ryan](https://oxfordre.com/psychology/display/10.1093/acrefore/9780190236557.001.0001/acrefore-9780190236557-e-309;jsessionid=640DFEF1EA7C80F143EAFBEEEB661FDA)). * ""Sexual differentiation genitals takes place sexual differentiation brain, making possible always congruent"" ([Roselli](https://www.ncbi.nlm.nih.gov/pmc/articles/PMC6677266/)). * ""Whether based sex, skin color, even determined arbitrarily, membership social group exerts profound influence human behavior, positive negative implications. Specifically membership social group shown promote positive social identity individuals derive self-esteem sense belongingness connectedness others serve buffer times stress. However, membership social group also promote negative biases toward out-group members, derogation in-group members violate group norms, disengagement certain areas one’s group negatively stereotyped (for example, women math)"" ([Lurye et al](https://www.ncbi.nlm.nih.gov/pmc/articles/PMC2661758/).) call made silliness want, facts. people sincere feeling self-concept gender match body. know dysphoria harmful psychologically. individuals allowed present way match self-concept identify group, [the rates depression sucidality go down](https://www.jaacap.org/article/S0890-8567%2816%2931941-4/fulltext). well, [transitioning gender presentation social acceptance one largest factors reducing suicide risk.](https://www.ncbi.nlm.nih.gov/pmc/articles/PMC3722435/). matter whether believe concept gender identity. causes harm people others accept concept self. agree someone want suffer. making important ideological stand something refusing acknowledge gender identity. asshole.', 'Sexism isn’t biological. Sexism based discrimination specific biological sex. It’s goal. event happen without direct goal. plenty feminists don’t encompass trans women beliefs without particularly working exclude purpose. TERF Trans Exclusionary Radical Feminist. radical part isn’t say they’re violent, they’re something sexism experience. don’t call TERFs. loud, beliefs repressed sexism. True, that’s confused caught backlash told I’m “not feminist” “an ally”. Something that’s ubiquitous society sexism would absolutely thought somebody would thinking transitioning. considering moving countries you’d think you’d treated based characteristics. white man I’d never feel comfortable Afghanistan Somalia, example. say this? Trans achieved hormone therapy, fact I’m well aware of. wouldn’t said all. Hahaha what? feminist. support women. point stands trans people aren’t women. identify women, I’m happy enough treat women. doesn’t make women base level. wouldn’t use bathroom presence trans man, wouldn’t feel comfortable. trans woman walks bathroom stubble, doesn’t matter identify, one look they’d told leave they’re women. What’s stop transitioning going women’s public restroom thrill? It’s matter safety comfortability.']"
37	44	37_emoji_emojis_ya_didachildwritethis	['emoji', 'emojis', 'ya', 'didachildwritethis', 'aspirant', 'flexing', 'completing', 'clevar', 'consolation', 'bruv']	"[""Apple needs fix emojis. can't pretend good guy texts filled Joe liked post. Sue also like post. Mark smiled."", 'even emoji 😂', 'really like emoji, also, rock roll emoji 🤙']"
38	43	38_glasses_eye_wear_eyes	['glasses', 'eye', 'wear', 'eyes', 'face', 'makeup', 'tears', 'dress', 'thumb', 'mask']	"['Especially wear glasses. always gettin caught', ""depends circumstances. Natural disaster? Since cannot anything else, tears additive effect (2 + 2 +...). enemy caused death family, get two tears eye, whilst rest needs converted anger swear vengeance clan. Oh man, that's rough one! long original 151 one True™ Pokemon games, count real pets (cats, Dogs pugs) - 2 tears each. Pugs God's mistake."", 'Interesting, I’ve never heard this. He’s prick can’t admit wears glasses? wear glasses damn proud it.']"
39	43	39_ball_dolphins_goat_brady	['ball', 'dolphins', 'goat', 'brady', 'peaked', 'game', 'coach', 'tom', 'football', 'pats']	"[""Sort of. game, Raiders Pats tied. could understand trying Hail Mary drawing DPI set FG attempt. laterals? thanks. 2006 divisional, made McCree fumble even stupid already 4th - even intercept all, could've batted ball down."", 'thought Pats game? EDIT: Yup. Final: Patriots 24 Chargers 21 EDIT 2: Miracle Miami 2018 Dolphins lateraled end game beat Patriots, IIRC first time ever worked NFL game.', 'Sounds like soccer problem. Baseball: GOAT peaked 20s Basketball: GOAT peaked 90s Football: Okay GOAT peaked 10s Hockey: GOAT peaked 80s']"
40	42	40_conspiracy_theories_jfk_conspiracies	['conspiracy', 'theories', 'jfk', 'conspiracies', 'theory', 'assassination', 'believe', 'suspicious', 'fake', 'sub']	"[""often sub seen. Perhaps know meaning conspiracy know well. seem combatant strategy tee. however place conspiracies.. little known stories next sources fabricated fiction proven correct. here, connect dots. hell bent proving every conspiracy wrong wish part take healthy discussion, question stands.. here? side note, comes belief find make believe wrong. I'd encourage look research much conspiracy theorists gotten right past 50 years."", ""bad machines, still come anywhere close establishing evidence scale conspiracy talking about. Messing elections countries messing elections country way comparable. one instance access resources United States could possibly give order achieve goal, sneak around collect resources make allies listen organize intricate conspiracy never gets big else chance someone within conspiracy spill. might well comparing apples oranges. He's also half brain dead geriatric old man whose handlers would never let air actually kind conspiracy going around. conspiracy think exists existed, would piece cake make sure video never saw light day even aired. nothing happened, slip tongue failed provide evidence contrary."", '""A"" conspiracy theory. mother conspiracy theories. term ""Conspiracy Theory"" invented specifically deflate theories surrounding suspicious details surrounding assassination president.']"
41	42	41_cats_dogs_dog_pets	['cats', 'dogs', 'dog', 'pets', 'chin', 'claws', 'fur', 'allergy', 'cannibalism', 'turtles']	"[""comparison would need delve person likes pets. fair comparison SUGGEST, MIGHT like cats like dogs, they're small pets, right lot time fair, even often right made specific comparisons person's reasons liking dogs. LMAO THAT'S ALLERGIES WORK LOLOL idea talking"", ""Cats dogs comparable. They're live birthed, fur, teeth, claws, domesticated pets, given silly names people, on. Yet somehow doubt anyone would ever make argument they're thing must treated same. they're obviously different things."", 'cats dogs']"
42	41	42_comment_comments_post_deleted	['comment', 'comments', 'post', 'deleted', 'report', 'pasting', 'gilded', 'reread', 'replying', 'responded']	['fifth time exact comment made last hours, kids pretty original comments!', 'Yeah man, gilded comment whole post free award schizo rant bottom hidden thread, 5 levels deep, minutes made it. fooling anyone lmao.', 'Much like comment.']
43	40	43_homeless_homelessness_utah_hotels	['homeless', 'homelessness', 'utah', 'hotels', 'solution', 'addiction', 'drug', 'problem', 'enabling', 'mental']	"['seeing homeless problem. drug mental health problem. Go YouTube search favorite large city add ""homeless.""', ""I've seen it. homeless covid San Antonio rented whole hotels homeless. mess. staying Hope stipend program. hotels trashed. means put homeless somewhere failed. Havens plan works. Psychology/Job/Home."", '""ended"" homelessness Utah changing way homeless counted.']"
44	40	44_israel_jews_palestinians_cleansing	['israel', 'jews', 'palestinians', 'cleansing', 'arab', 'jewish', 'ethnic', 'antisemitic', 'hamas', 'palestine']	"['Well, Palestinians refused UN partition plan attacked Jewish Yishuv assistance Arab countries volunteers, end 1948 still much land intended them… except Egypt Jordan occupied 19 years. countries held Palestine, denying Palestinian sovereignty, rest invading Arab armies compensate them. Arab country belligerence caused West Bank taken, reason responsibility. illegal settlements, Palestinians invited them. There’s reason Israel required large Arab Israeli minority, Palestine gets insist free Jews. enjoy minority far Right Jews Palestinian citizens. BTW, since raised ‘Apartheid’, I’m curious you’re aware Israel Arab minority since 1948, Jews ethnically cleansed Arab conquered territory time? Jerusalem cleared Jews first time since Roman times. Jews allowed remain West Bank lived centuries. Jews barred even praying Jerusalem, first time since Roman times. anyone track record total ethnic cleansing Apartheid, it’s Palestinians Arab countries.', ""Israel gives part Israel (not illegal settlements, actual Israel proper), guess could fair deal. heard proposal, assume refers Arab majority areas. I'll honest though, Palestinians bad actors, see appetite peace either side. see Israelis supporting removing settlements, see Hamas ever wanting end conflict. see Israelis trusting Hamas end conflict, see should. really get Arab countries compensate Palestine though. ones barred Palestinians returning Israel. (And agree Arab nations pay reparations Israeli Jews expulsion, find separate issue. issue Israeli Jews Arab nations. Nakba reparations similar issue Palestinians Israelis imo.)"", 'should. Israel also pay lost real estate caused allowing Palestinians right return following Nakba. issue this, Israel decide make people whole. aware this, yes. really fail see ""they ethnically cleansed us first"" suppose prove here. &gt;So anyone track record total ethnic cleansing Apartheid, it’s Palestinians Arab countries. Israel, even *total* ethnic cleansing. really see ""Arabs ethnic cleansing first"" means Israel too. clear, say: saying Israel history ethnic cleansing apartheid? I\'m reading sentence. Israel forbid large number Palestinians fled Nakba returning. ethnic cleansing. Even large number fled reasons forced Israelis (fleeing fighting, fearing massacres (even unfounded), advice Arab leaders), refusing allow return ethnic cleansing. Look laws Israel applies Palestinians Jews, others. Israel allow naturalization Palestinians West Bank Gaza marry Israeli national. problem ethnicities/nationalities. Israel considers Palestinians demographic threat. major point toward Israel apartheid state. large number South African anti-apartheid leaders pointed Israel\'s policies Gaza West Bank similar Bantustans. able leave privilege afforded anyone. Palestinians annexed East Jerusalem granted rights Israelis following annexation. given ""permanent residency"", thing citizenship, revoked. say nothing fact Israeli annexation East Jerusalem violation international law. annexed area give occupants rights others. also lose residency status, displacing homeland. discriminatory. actually find argument Israel apartheid state convincing time, see people feel way. general point topics Israel committing ethnic cleansing discrimination ok with. Arab world extremely anti-semitic? Yes, course! believe Islam honestly pretty anti-semitic. mean Israel also discriminating Palestinians. Israel lot power fight. ethnic cleansing Jews Arab wrong? Yes! Arab world owe Jews reparations? Also yes! mean Nakba ok, mean reparations needed. Hamas genocidal? Yes! mean Israel treat Palestinians threat nature nationality.']"
45	38	45_christmas_lights_santa_gift	['christmas', 'lights', 'santa', 'gift', 'choo', 'holiday', 'eric', 'gaslight', 'libright', 'greatest']	"['mean, *A Charlie Brown Christmas* also Christmas special ever correctly answer question ""what\'s true meaning Christmas?"".', 'Christmas lights', 'want Christmas.']"
46	37	46_china_taiwan_troops_ringing	['china', 'taiwan', 'troops', 'ringing', 'chinese', '80000', 'chinas', 'penis', 'invade', 'military']	"['“Ringing” China? China bordered Russia, India, North Korea, on- no, US troops ringing China. 80,000 troops going China’s 2 **million** anyway? Taunt second time?', ""pay attention government spokesmen say consider implications. Disbanding NATO little extreme. plausible NATO become less important time, Russia threat. Traditionally USA top dog there, military strength western europeans believed could defend Russia without us. belief may gone now. We'll see. sounds like unclear concept. Generals generally try ready refight last war. lost last war, realize need something different. something different costs maintaining existing approach. Yes, concept could create peace. never caught reality. OODA loop around 6 months, every 6 months would notice existing approach working, we'd announce new approach would take 6 months confirm also work. that's military strategy, Congress's pay grade. Congress mostly increase funding decrease funding. recent decades Congress always increased funding. discuss why. know. hope don't. China main excuse increase military spending. arms race them. going fight them, would military spending affect ours? Maybe could fight defend Taiwan. China probably invade Taiwan. that, expect win smoking ruin. better get Taiwan reconcile them. MAYBE attack Taiwan, think CIA knows make that. effective getting Russia invade Ukraine, doubt could make China invade Taiwan. deep-water Navy much better China's probably there's big new breakthrough. Aircraft carriers beat battleships, nothing beat aircraft carriers yet. Except expensive slow build, spend resources defending instead attacking them. Anyway, time comes new technology makes fail -- big swarm cheap drones, say -- give least one sunk badly damaged, panic start crash programs various sorts. can't predict happen. seems extremely unlikely China invade USA. Would go Siberia Alaska Canada? big war we're preparing -- possible military justification bloated military budget -- would invade them. doubt it. bothers government leaders either. look do, hope makes sense. try make sense it, results come logical insane."", 'Correct. US 80,000 troops, planes, ships etc ringing China Korea Japan proxy Taiwan. post said ""China\'s border"", lie? Furthermore, ringing something means surround it. Troops two small areas land China\'s east constitute surrounded stretch imagination. Plus troops South Korea separated China North Korea, country China supported years reason troops first place, China knows that. troops Japan separated China Sea Japan, Koreas Russia that. claiming US troops ""ringing China"" 80,000 US troops China\'s border incredibly dishonest. since US troops Taiwan, that\'s another bad faith argument.']"
47	36	47_party_dems_republican_democrats	['party', 'dems', 'republican', 'democrats', 'gop', 'republicans', 'disarray', 'federal', 'destroy', 'midterm']	['republicans hold house, senate, executive branch right democrats? democrats saving grace republicans horrible. didn’t someone worse point would really fucked. “This country needs strong Republican Party” -Nancy Pelosi', 'mean bad GOP good Dems, vice versa. two party system viable third option, least yet, cooperation sides slim none. doubt many people would argue democrats room improve, absolutely fair say democrats good midterm, GOP not.', 'fiscally conservative individual (apparently socially conservative gender fluidity nonsense) theory Trump insurgent planted dems destroy Republican Party. working. extremely reckless spending absurd social/foreign policy ideas, current administration everything give White House back competent admin. competence Republican Party right now. I’m afraid country look like another six years “progressive” politics']
48	36	48_kino_gt_ryder_rider	['kino', 'gt', 'ryder', 'rider', 'barbie', 'arthur', 'futurama', 'cartoon', 'chuck', 'boomer']	['Futurama great cartoon.', 'Barbie kino. Across Spiderverse kino. Christopher Nolan kino', 'Chuck Ryker &gt; Chuck Ryder &gt; Easy Ryder &gt; Easement Rider &gt; Appeasement Rider']
49	35	49_eu_uk_brexit_british	['eu', 'uk', 'brexit', 'british', 'forefathers', 'nhs', 'bless', 'euros', 'finland', 'defense']	"['Sure, thats main cause now, Brexit still causing havoc, labour markets, food, transport, massive cluster theres sign getting better. Some, huge surprise, EU dependency Russian energy always going bite ass.', ""EU starts EU's defense US start spending literally money fix shit?"", ""Non brit here. demands NHS seems reasonable though wonder current situation UK much problems due effective contraction whole economy due Brexit Tory's management. Either way someone track issue closely see Labor loose siding NHS - would seem like good opportunity give shots direction Tories...""]"
50	34	50_facts_truth_lie_somebody	['facts', 'truth', 'lie', 'somebody', 'lying', 'tries', 'humanity', 'sad', 'cencor', 'creeping']	"['Facts Facts?I hear now!alternative Facts, touring building. mild loving people. said yesterday. Send jail!I tired waiting happen!', ""What's truth?"", 'You’re somebody. somebody bad facts lives mama - see least honor humanity communist, become nihilist Nazi sympathizer lies tries negate truth humanity someone destroys lies facts']"
51	34	51_water_drink_drinking_sodium	['water', 'drink', 'drinking', 'sodium', 'diet', 'coke', 'distilled', 'minerals', 'poisonous', 'tapwater']	['water rights. novel “Water Knife” good near future dystopia around theme', 'People fat know water. Got it.', 'ever seen commie drink tap water?']
52	32	52_mdma_ecstasy_weed_drugs	['mdma', 'ecstasy', 'weed', 'drugs', 'molecule', 'drug', 'od', 'feeling', 'meth', 'pot']	"[""That's MDMA is. MDMA molecule, feeling."", 'depends using word. say feeling ""ecstasy"" means extremely happy. Someone else, already established talking MDMA might mean MDMA say ""ecstasy.""', 'Ecstasy MDMA. feeling get MDMA molecule ecstasy. know fighting hard like scared people buy pills anymore someone Reddit said summon feeling get tab themselves.']"
53	31	53_point_nope_contradictory_surprise	['point', 'nope', 'contradictory', 'surprise', 'obviously', 'correct', 'clear', 'interchangeable', 'elaboration', 'misdirection']	['correct Nope. Quote disagree.', 'obviously point.', 'every single point. Literally point. point originally claimed several things, abandoned proved futile defend.']
