Topic	Count	Name	Representation	Representative_Docs
56	18	56_meat_co2_vegan_20221219	['meat', 'co2', 'vegan', '20221219', 'dairy', 'emissions', 'animal', 'industry', 'reduces', 'steak']	"['This look like money, motherfucker? Money. Be. *Green*. Money *feel like* money.”\nj0s78m3\tchangemyview\tj0s5ari\tzohial\t20221219\t2\tWolf97\t You keep repeating this as if that will make it true lol    Might want to take your own advice there champ.\nj0s78sk\tsocialdemocracy\tj0s29d4\tzovhlj\t20221219\t2\tRealSimonLee\tAt the very least, it requires careful planning, lots of time dedicated to researching how to get all the nutrients you need from a vegan diet, and it seems overwhelming to lots of people.\nj0s78t8\tconservative\tj0rf6sz\tzp4k2f\t20221219\t92\tSection225\tBut okay what about their skin color?   Ever think about that?  Hmmmm?\nj0s78ve\tconservative\tj0ri6xc\tzp14r6\t20221219\t-8\tcarlsab\tYou are entirely wrong. I didn’t go to med school but am a doctor and took the classes with the med school. This is not political. It was taught to me by absolute conservatives who are Trump conservatives to this day. Race is a construct and has led to medical errors and biases in my field and in other areas of medicine. It is a data point but very rarely has diagnostic value. It is not being pushed by politicians, it is being pushed from the research at academic universities.\nj0s791e\tchangemyview\tj0s5teu\tzp7e7f\t20221219\t1\tchangemyview-ModTeam\tYour comment has been removed for breaking Rule 5:    Comments should be on-topic, serious, and contain enough content to move the discussion forward. Jokes, contradictions without explanation, links without context, off-topic comments, and written upvotes"" will be removed. Read [the wiki](https://www.reddit.com/r/changemyview/wiki/rules#wiki_rule_5) for more information.    If you would like to appeal, review our appeals process [here](https://www.reddit.com/r/changemyview/wiki/modstandards#wiki_appeal_process), then [message the moderators by clicking this link](http://www.reddit.com/message/compose?to=%2Fr%2Fchangemyview&amp;subject=Rule%205%20Appeal&amp;message=Author%20would%20like%20to%20appeal%20the%20removal%20of%20their%20post%20because\\.\\.\\.) within one week of this notice being posted. **Appeals that do not follow this process will not be heard.**   Please note that multiple violations will lead to a ban, as explained in our [moderation standards](https://www.reddit.com/r/changemyview/wiki/modstandards).', ""I'm a biologist by training, so I know all about this. The problem is that the ecological issues are not limited to CO2. The meat and animal products industry is responsible for a large share of methane (CH4) emissions, a GHG 25 times more potent than CO2 in terms of warming potential, and nitrous oxide, 100 times more powerful. This industry is also responsible for at least 60% of global deforestation, including more than 75% in the Amazon, which significantly increases CO2 emissions and affects carbon sinks. I could also talk about soil contamination, of which 30% of the degradation is attributable to the meat industry. Or the contamination of water tables and rivers or the massive use of land.     There are also epidemiological and public health arguments, as industry has been responsible for many of the epidemics and pandemics in human history. Besides, it uses 80% of the antibiotics in the world, leading to a resistance that today is becoming a serious scientific problem."", ""All of that is a great reason why one should look to reduce their meat and dairy intake. It still fails to be the best thing an individual can do though because even if I go vegan that cow is still getting raised those trees cut and those GHG emissions are still happening. However my choosing to take public transport is something I do that actually reduces co2. My replacement of all my gas appliances and removal of natural gas from my home reduces methane. My going solar also reduces methane, my area is powered by natural gas. Those things have actually prevented more GHG emissions. Veganism works only by collective action to shrink the meat industry. Individually is like carbon offseting interesting in theory but in reality it doesn't make measurable difference.  Edit: not to mention meat and dairy reduction is attainable for more people and meets them closer to where they are. You want the world to go vegan start winning hearts and minds. You want more people like my brother who thinks all environmentalists are going to take away his steak keep up the scorched earth campaign.""]"
57	18	57_mao_fascism_oppressed_marcuse	['mao', 'fascism', 'oppressed', 'marcuse', 'fascist', 'wing', 'friero', 'discord', 'was', 'were']	"['I’ve blond hair, blue eyes, and I believe in the doctrine of Fascism. I’ve read Mien kampf, evola, jünger, the doctrine of Fascism.  Now what I hate more than anyone. Is the neo American Nazi. Y’know the type. Dark hair, dark eyes, typically overweight, and ugly.   Those that claim “racial superiority” while descending from inferior European stock, but just because the ape is more intelligent than the dog does not mean I’d marry my daughter to an ape.   You are banned from discord for being a Nazi. I can never return to the fatherland. We are not the same.', 'I\'ve unironically had a retard on discord (one of the mods of the r/politicalhumor discord) claim that Mao was right wing.  His logic (I don\'t think I\'m exaggerating, this genuinely seemed to be the train of thought) was that left wing means good, and right wing means bad. And Mao was bad. Therefore, Mao was right wing. He threatened to ban a friend of mine when they called Mao left wing, because the mod claimed that was ""defending Mao""', 'Means nothing more than, ""takes I disagree with.""  Hitler, no less, said that he was a socialist.  The nazis presented the Germans as an aggrieved people, and said that Jews were the population within Germany responsible for backstabbing Germany, among other perceived historical injustices, and demanded social justice, sound familiar?  The left is all about wielding political power.  Marx thought the proletariat would overthrow the bourgeoise and put ""right thinkers"" like him in power.  Koch and Gramsci, and the short-lived Frankfurt School, decided that the proletariat were too invested in the system, but if they could just get their hands on the kids, then they could teach the kids the right way to think and the kids would rise up and give them power.  Mao ran with that idea, it\'s where he got his red guard from.  From there it goes to the generation Marcuse and Friero, whose poison we are still dealing with today.  You see, when people catch on that you are teaching their kids to hate their culture and hate their parents, people tend to become a bit agitated for some reason.  Marcuse and Friero decided the correct course of action was to agitate societies ""oppressed"", and it didn\'t matter what kind of oppressed, racial minorities, sexual minorites, it didn\'t matter.  They were all the ""oppressed"" and could be agitated to start the revolution and give people like Marcuse and Friero the power that they craved.  You might shrug, but Friero\'s ""Pedagogy of the Oppressed"" found it\'s way into the ""College of Education"" throughout the west.  Since about 1990, it\'s been the guiding notion of education in school.  Go ahead and read it, you should see the problem.  Then came Krenshaw.  She forged the one ring to rule them all, just like Sauron in Mordor.  Her issue was that all of these groups were competing.  She created a map of the oppression.  She argued that not everyone was equally oppressed, and the more oppressed, the more of a victim, you were, the more important your words were, no matter if your intentions were unmistakably evil.  Hence the current oppression olympics the left currently engages in where the more pathetic you are, the more you must be catered to.  Her answer, you can guess, give ""right thinkers"" like her power.  Just look at what is going on with social media and tell me I am wrong about any of it.']"
58	17	58_he_wife_his_him	['he', 'wife', 'his', 'him', 'married', 'was', 'sounds', 'christofacist', 'cries', 'magas']	"['His wife left him', ""https://youtu.be/hSNWkRw53Jo  Here's a pretty solid summary of the guy.  Basically a self help scammer for magas who went all christofacist.  Also he cries for no reason cause he broke his brain by putting himself in a coma in Russia to get through benzo addiction"", ""[Remember this?](https://youtu.be/4tT3qvR2IXE)  A year ago while his wife was going through treatment. He disappeared for weeks and when he showed back up he clearly was unable to breathe.   He's acting in bad faith. 100% knows the ramifications of his actions. Evil bastard.""]"
59	17	59_gay_sex_construct_sexuality	['gay', 'sex', 'construct', 'sexuality', 'gene', 'mating', 'reading', 'social', 'norms', 'construction']	"[""Even that doesn't make sense because what does it even mean for sex to be a construction lol. You don't have to answer. I have been thinking about reading foucault and this is another nudge towards the direction. But then, I wonder, maybe something else is a pre requisite for him!  So I never know where I want to go lol. But it's all good I'm triangulating a trajectory. I'm not going to school so I just find my own way to the things I wanna learn about."", 'I wonder if gay animals are more prone to disabilities and the gay gene gets activated. To sort of filter them out of the gene pool. As if it was some sort of fail safe to keep the species running.', ' You literally used that word lmao.  Did you forget your own comment?  So a little lesson for you in linguistics: we use different terms, even when they have nearly synonymous definitions, to describe specific situations and actions based on social norms and accepted appropriate behavior.  Normal people do not refer to sex as ""mating"" because it sounds weird and creepy.  It\'s human beings having sex, not some endangered species of reptile on a nature documentary.  People who understand and follow social norms do not use the words you\'re using.  Does that make it a little clearer?']"
60	17	60_covid_virus_shutting_really	['covid', 'virus', 'shutting', 'really', 'death', 'airborne', 'measurements', 'stop', 'no', 'went']	"['Now take out all the deaths that were attributed to Covid because they were found to have covid at time of death but were otherwise unrelated.', ""Is it really suppressing information when it's really just their guidance on it that has remained unchanged. I mean it really all comes down to who you feel like believing I guess. The scientists or the grifters that fall in line with the narrative. I know so many people that have gotten COVID multiple times many of which are kool aid drinking joe rogan listeners championing the stuff yet when they got it they wouldn't take it... huh"", ""Not really. Covid is still out there. Just new things in the news cycle. No one cares anymore. Ukraine took the spotlight and suddenly pan-what-are-are-you-talkibg-about? Threat of Nuclear war is so much more effective and existential. No one has to actually die and no one can prove they didn't stop the missiles from flying.  When people started to see that covid wasn't as scary as they said it was they just pivoted into the next crisis  This isn't complicated stuff. It hardly qualifies as conspiracy anymore. Its just how the media serves its masters. (The billionaires that actually are served by the government.)""]"
61	17	61_fbi_laptop_political_russians	['fbi', 'laptop', 'political', 'russians', 'platforms', 'hunter', 'agencies', 'drake', 'wray', 'ignore']	['Everyone knows the story, but the FBI said there was nothing incriminating.   It’s like the hunter’s laptop stuff…  Just nothing incriminating, and people’s private lives exposed, likely leaked by a foreign agency, which is great for opposing parties, but is just a distraction for dupes to go by on about online and ignore real things happening.', 'The Russians admitted it several times. Our agencies provided evidence (“the kremlin papers”).  The CIA and FBI are not political. Not even a private in the military can be political. We have rules and if they’re broken, people are punished.   The FBI agents that discussed political views were fired and lost pensions.  You have no idea how good our military and intelligence agencies are BECAUSE they aren’t political.   This isn’t Reagan’s CIA.   You can repeat Russian scripts all you want but I’ll keep asking you why you ignore the Russians admitting it themselves.', 'The FBI didn’t suppress it and (in my opinion) shouldn’t be able to. They wouldn’t call it digital terrorism either — the point isn’t to terrify, it’s to influence an election (assuming the Hunter Laptop was part of a hack and leak operation, something which hasn’t been proven or disproven yet.)  The FBI warned tech platforms that Russians would interfere in the election yet again, and they went over different ways they might possibly interfere. One way might be to hack and leak information.  It was up to individual platforms how to respond to election interference.  Tech companies mostly want to combat disinformation. People want to trust the information they get from social media platforms. Leave up too much misinformation and spam and people won’t find your site trustworthy. But censor too much too arbitrarily and people will think you’re hiding the truth and you’ll loose trust that way too. So it’s a tightrope.  And the government really needs to be kept separate from the media for democracy to function properly. You don’t want the government suppressing information for a lot of good political ideological reasons. But also practical reasons — it’s almost impossible to remove information from the internet, and failure creates a Streisand effect. (I think Twitter trying to block the NY post story just brought more attention to it in the long run.)']
62	17	62_study_article_research_read	['study', 'article', 'research', 'read', 'thanks', 'justification', 'methods', 'subject', 'reading', 'journeys']	"['What the actual fuck? This study is worse the more I hear about it.  Btw thanks for you and those with you reading it for the rest of us. The premise of the study sounded too dumb for me to even try, and thanks for proving that right.', ""I'm asking because it doesn't look like the pdf that was linked above is going to explain how it justifies any of the statements made and said justification is rooted in the various concepts used, which have no explanation because it is implied that the reader already knows what they mean.  Such as regulatory norms and forcible materialization.  It looks like one has to know foucault for one. But what else would one have to read?"", "" Except that's a very subjective evaluation. How many on-the-fence lib or prog normies who are just now noticing the problems with idpol could read this article and gain some insight from it? Different people are in different places on their journeys. I mean, we all need intro texts at some point in our lives. Perhaps her article is a somewhat shallow and broad summary of the current state of things but I don't think that makes it worthless.""]"
63	16	63_ammo_certificate_identification_photo	['ammo', 'certificate', 'identification', 'photo', 'birth', 'begin', 'purchase', 'hypothetical', 'california', 'requires']	"[""Explain to me how this hypothetical person is able to purchase ammo in the state of California that requires a photo identification and a birth certificate, if they can't even get ID to begin with?  Why won't any of you answer my questions."", ""Explain to me how this hypothetical person is able to purchase ammo in the state of California that requires a photo identification and a birth certificate, if they can't even get ID to begin with?  Why won't any of you answer my questions."", ""Explain to me how this hypothetical person is able to purchase ammo in the state of California that requires a photo identification and a birth certificate, if they can't even get ID to begin with?  Why won't any of you answer my questions.""]"
64	16	64_roads_cities_town_road	['roads', 'cities', 'town', 'road', 'exist', 'towns', 'humanitarian', 'city', 'toll', 'lots']	"["" No it isn't unless a LARGE group is left isolated and that large group would have both funding and profit incentives to create roads which would solve the issue.    Right and then there would be profit incentives to build roads there long before a town becomes a city. This isn't the problem you think it is. It's literally the solution.    But there's already lots of roads so far too much competition. Besides the land for the roads would be prohibitively expensive reducing incentive. There's also lots of profit in connecting cities and then small roads are built off of that city connecting highway to connect towns to the city. That's again called a capillary style of road building. It's the same process which living things get their blood supply to every cell with minimal energy expense."", ' Not the point at all.    No they won\'t. That\'s ridiculous.      That\'s not the way it works at all lol.    That\'s only toll roads. There are other types of roads lol. Developments don\'t have issues with roads. Towns are quite capable of roads. The only thing companies need to do is connect cities and the other solutions will fill the gaps.    Right. But roads here exist both before and after towns. Toll roads exist and other side roads leech off them. Unlike a body ""starving"" means a town not competing financially so it being weeded out is not as bad a thing.', "" Ok. And?     Sure and they have more roads and more road maintenance vs less roads and less road maintenance in rural areas. See your operating off the premise that roads already exist and must be maintained but if those roads didn't exist there wouldn't be people in those areas until those roads did exist.    Bc there would be little profit in another road in the city. You'd see major toll highways with small private roads branching off them to connect to towns. Like I said a capillary like system instead of a grid like system.""]"
65	16	65_approved_pfizer_experimental_moderna	['approved', 'pfizer', 'experimental', 'moderna', 'fda', 'mdma', 'azt', 'mineral', 'study', 'iirc']	['It is not. Pfizer and moderna are approved by the FDA and no longer emergency use only', 'Pfizer has been fully approved for 16 months. Moderna is coming up on a year in January. Were you not aware of that?  So given that what does experimental mean?', 'Why would you use FDA approval as a signifier if a drug is experimental or not and then when it’s shown to be approved say it doesn’t matter anyway? It’s literally not experimental by your own definition so maybe update your talking points. So when will they no longer be experimental in your opinion since your deciding it ad-hoc?  You also seem to be confused about AZT for some reason. Probably because of Fauci, right?']
66	15	66_porn_nanny_account_rot	['porn', 'nanny', 'account', 'rot', 'societal', 'internet', 'access', 'destruction', 'gop', 'ban']	"['Libertarian ideology like this should be purged from the GOP.  Porn destroys families and people and contributes to rue societal and moral rot in our nation. It is a great idea to ban it.  This is why the GOP loses. Every time someone tries to grow some balls and actually exercise power to fix things, fake conservatives like you denounce that person for advocating for a ""nanny state""', ""I'm not opposed to that, I'm just saying that a porn ban sits on the same logical fallacy gun control stands on: those who don't care about the law will still get what they want. Teens look at porn because they want to and they can. It's the same problem as cigarettes, alcohol, etc.   However, if websites that show pornographic material on them require ID submission or anything like that, I can't get behind such a blatant privacy issue."", 'But porn is free now']"
67	15	67_documents_prove_proof_returned	['documents', 'prove', 'proof', 'returned', 'knew', 'crime', 'trump', 'he', 'classified', 'werent']	"[""Those people broke the actual law, look up the actual law, they weren't authorized to take tge documents, Trump was.  What you need to prove is that Trump purposefully didn't return the documents which you cannot do.  There is no proof Trump didn't know all the documents weren't returned.  You have to prove he intentionally held on to classified documents. You cannot prove the intent which is why he won't be charged.  If you don't think proving intent matters, look up why Hillary wasn't charged for not turning over all the classified documents she had in her basement on the server.  If you cannot prove intent to conceal, then you cannot prove he committed a crime"", ""You have no proof he lied.  Prove **he knew** he still had documents, because that is what you need to prove to convict him of a crime.  They couldn't prove Hillary **knew** she was deleting work emails that were supposed to be turned over to the DOJ  They cannot prove that Trump **knew** he still had classified documents.  This is why there was no indictment  of Hillary and why there will be no indictment  of Trump.  A lie is when you know you are wrong and say it anyway. You can prove Trump was wrong but you cannot prove he knew he was wrong.  In the end there will be no trial, you will be confused and outraged but you shouldn't be as I just explained why."", ""It's amazing how few people know what a lie is.  Again, a lie is when you knowingly attempt to deceive.  Being wrong about something doesn't make it a lie.  You have to prove Trump knew documents weren't returned.  Finding some random documents isn't proof Trump knew they weren't returned.  * prove Trump sat at that desk and opened the drawer after saying all the documents have been returned  * lawyers coming up with multiple defenses isn't proof a crime was committed.  You have to prove Trump knew that all the classified documents  hadn't been returned.  There is zero proof of this (at least known to the public)  You need the DOJ to have some sort of secret proof he purposefully mislead.  Hillary wasn't charged with a crime because they couldn't prove she purposefully deleted emails she was supposed to turn over to the DOJ despite proving she deleted emails she was supposed to turn over.  I don't give a shit about Hillary is just a perfect example that shows that you need to prove **intent** not just that it hapoened.""]"
68	13	68_his_he_walter_later	['his', 'he', 'walter', 'later', 'def', 'sympathetic', 'episode', 'season', 'pride', 'seasons']	['I mean the kid was making fun of his disabled som and he had just gotten told he was gonna die in 2 years. I struggle to see a person that would not lose it at that point. He definitely did have a pride issue when it came to elliot and gretchen but it still isn’t known what exactly the position is. At this pt the story still paints walter as a robbed overqualified hs chem teacher. I mean by season 2 he got kidnapped by a pyscho and his first move was to run with his family. He didnt go full mask off till season 3 after letting jane die and the airplane crash', 'I mean after the plane crash is when he freaks out on the cop and tries contacting gus as well as his poisoning of Brock. I dont remember him kicking the shit out of the teen at all. All he did was tell the kid to fuck off and stop mocking his son. He legit only kneed them. I mean I sure as hell would defend my son if they were mocking him for his disability. Not in the way if walter but all the bombs he got dropped that episode just made the outburst alot more likely. Walter was def portrayed sympathetically to start out and his character progressively becomes worse', 'The whole point at that part of the story was to say that he was being given an unfair card by elliot and gretecheb. They def meant well and his pride got in the way. But in his pov they were taking advantage of him and he still had anger from grey matter (which was stupid of him we later learn). At first he was def doing it for his family but later as he says in the final episode he was just “doing it for me”. His full on adoption of heisenberg begins sometime after he lets jane die and the plane crash']
69	13	69_tesla_shareholders_board_nooooooo	['tesla', 'shareholders', 'board', 'nooooooo', 'tens', 'paycheck', 'ceo', 'billions', 'his', 'him']	"['This is just a cover for him pulling back from his shitposting for a few days because the Tesla investors have been taking to Twitter to scream at him to stop screwing around and do his job at Tesla.', ""it helps when you remember he's lost tens of billions of dollars (in Twitter valuation) and tens of billions of dollars more (Tesla shareholders freaking out) because of it."", 'Shareholders vote for the Board every year or, at least with most corporations, 1/3 of the Board every year. And shareholders can vote for anything at any time (if they’re willing to pay for it).']"
70	13	70_live_florida_south_places	['live', 'florida', 'south', 'places', 'googleing', 'mf', 'creationism', 'oho', 'suburbanish', 'camden']	"[""In some areas. I live in Arizona so there's a lot of Spanish speaking people here."", ""Damn that's a lot of them, are you sure you'd want to move to some of these places though? South Carolina? Oh*o?"", ""There's at least five places in Florida to entertain you as they sell you creationism.""]"
