Topic	Count	Name	Representation	Representative_Docs
-1	2278	-1_the_to_of_and	['the', 'to', 'of', 'and', 'that', 'it', 'you', 'is', 'in', 'they']	"[' At first when I read this, I thought ""that\'s strange; in all choices, their are right and wrong choices"" but after reading the comments, since the alternative is misery, I understand it may be worth the risk.    The concept of having no Plan B was probably the biggest issue I had in these types of situations and that totally clouded my judgment.     This gets a Δ because now that you mention it, they got to travel, for ( basically) free while young, experience careers, and now they get to start over with a fresh start and a lot more great stories to tell about life and themselves. And it isnt like choices like these can be made in the future with a family so I get the value of learning here.', 'How is he running Twitter poorly? It was losing money, so he fired redundancy. Many other tech companies quickly followed suit. So you are off base there. He tried to do the $8 blue check, and executed that idea poorly. Should start charging EXISTING blue checks, since most are corporate, celebrity, or government associated accounts, who can all afford the $8/month to verify who they are. That should have been his revenue base.   He also cleaned house with evidence what Twitter was doing (and claiming NOT to do in front of Congress) which is to manage traffic on the site. It was a good thing for one side, and a bad thing now that the shoe is on the other foot. He is Wiley, and is rattling cages. However, people are now talking about censorship in social media, and this may spread to other companies (Meta, Reddit, etc).   How would you say he is running the company poorly? One that was losing money, and beginning to work hand in hand with the government? What are your recommendations?', '1. The options did partially overlap. Having a poll with only 2 options isn’t an issue regardless though. If the majority opinion is that they should be unbanned, that option will still win. So what exactly is the problem?  2. To the best of my knowledge he isn’t disallowing people from linking their other socials. He’s just preventing people from straight up posting “come use this site instead of Twitter”. That’s just a normal business move. When was the last time you saw a Fox News ad on CNN?  3. Just because anyone can get the information doesn’t mean he has to facilitate it’s spread. Especially when there is a potential danger to him from this information. Honestly dude someone doesn’t want to be followed everywhere and you’re saying “what about free speech?”. That’s such a dumb argument and you know it.  As I said, the only reason you’re going after Elon is because you hate his political views and hate that he’s giving a platform to people you dislike. We both know that’s the truth.']"
0	124	0_liberal_conservative_left_leftist	['liberal', 'conservative', 'left', 'leftist', 'right', 'conservatives', 'are', 'you', 'the', 'political']	"[""Yes point the finger away from your bullshit. Point to another quadrant,  so you can pretend your innocent.    Pick someone else to bullshit yea. I don't trust the Left, you guys are unhinged fucking lunatics. You hate constantly and worse you try to punish anyone who questions you.   I'll tell ya what. I've been banned from every left leaning sub, mostly for asking a question or offering a different view or just for not agreeing. I was banned yesterday from 2 subs, just for not hating Musk!! You're hypocrites. Your truly the most hateful,  hypocritical people on Earth. So save your finger pointing, I'm not for sale.  Most don't hear what you say cause your left huh? So then they treat you, like you treat everyone else. As if you listen to the right or try to understand them. No you call them named and banned them. Self righteous,  doesn't equal righteous."", 'It\'s some seriously self aware wolves shit from them:  AmericaFest is hosted by right-wing organization\xa0Turning Point USA\xa0and was founded by conservative activist Charlie Kirk.  The Left may report on these grifters but it is the right who platforms them and creates the need for such a response.  The left reports on these lunatics keep average citizens aware of the extreme rhetoric on the right. Without traditional media reporting on this, the extremists create their own bubble and the ""less extreme"" would be able to write them off as ""lone wolf""s and ""loonies"" but the very idea of free speec as outlined in John Milton\'s Areopagitica requires this sort of response to less rational actors in order to maintain some expectation of rationality in responses to absurdity.  Meanwhile, the extreme right constantly tries to present people using social media to express themselves, as cringe as it might be, as though that is indicative of the entirety of the democratic party.  It\'s some downright ridiculous absurdist argumentation from a clown of a clout chaser who only has a voice in the political sphere because his father helps to embolden these sorts of political tactics through abuse of the bully pulpit.', ""My favorite explanation, by Rothbard, has it going back earlier still. That what began as a liberal revolution in the 18 th century, they made unprecedented gains in overthrowing monarchy globally, soon shifted to a rearguard action where they began defending what they had gained rather than pushing forward with further gains.  A radical creed became in this way a conservative defensive, over time. The liberals of that day abandoned radicalism, thinking that society would evolve naturally over the next eons towards liberty, under the cultural influence of darwinism.  He specifically singles out Herbert Spencer as emblematic of this ideological shift.  But I think the problem of that day was primarily a deficit in theory. They did not have adequate theory to understand how to apply the principle of liberty any further than they had achieved.  The old regime was overthrown because they knew very well what they were against, but they did not know well what kind and shape of society could be built that was in line with the philosophy of liberty.  Only with the resurgence of liberty ideology after WW2 with Rothbard, Friedman, and Mises do we get a resurgence of theory such as arguably hadn't been occurring for a few decades, or with only a few figures.  During that time, the mantle of the radical opposition group was taken up by the Marxists, who are unfortunately a false revolution.  And I would say that's the main reason why we have trouble getting off the ground currently, people who recognize there's something wrong with the system are too often being driven towards Marxism as the solution, whereas they used to be driven into classical liberalism ideas.  For a resurgence of liberty philosophy, it may be necessary for socialism to first die or be rejected as a liberal creed.  But that's not happening, and in fact it grows like some kind of virus. Because it feeds on the wrongs of the current system.""]"
1	118	1_pregnancy_abortion_fetus_sex	['pregnancy', 'abortion', 'fetus', 'sex', 'pregnant', 'life', 'not', 'unborn', 'women', 'to']	"[' It was brought up because those are much better at preventing unwanted pregnancies, if you are truly in favor of those it\'s odd of you to ignore those points since widespread sex education and easy access to contraceptives drastically reduce abortions, especially compared to your idea of just telling people not to have sex. The points still stand in general though, since conservatives are largely against sex education and easy access to contraceptives.   The overwhelming majority of anti-abortion people are religious, the entire movement is founded by modern religious groups. Once they die out, so will their ""cause"".   It\'s not alive, it\'s not the same as killing a baby that\'s alive. It seems like you\'re aiming for a ""gotcha"" here by pointing out that you can be charged with murder for causing the unwanted termination of a fetus, but that does not conflict with abortion. Abortion is the choice of the woman carrying the baby, kicking a pregnant woman is not the woman\'s choice, and that\'s why there is a law against it. That same law even has a provision explicitly stating that it does not apply when a woman consents to have an abortion.', ' All women are marginalized in a forced birth society, and women who would have been alive aside from abortion bans are killed BY YOU.  Just because sometimes people die naturally does not make killing women okay. Would you accept it if I told you that abortion is perfectly fine because sometimes fetuses die?   FORCED pregnancy is not okay.   FORCED pregnancy is not okay. FORCED pregnancy is rape. You seek to rape and kill women through FORCED pregnancy.   Some people may have a heart attack naturally but it\'s not okay to deliberately give someone a heart attack.  Some people may die naturally but it\'s not okay to kill them.  Some women die in childbirth but it\'s not okay to kill women in childbirth.   Sure: [https://www.commonwealthfund.org/publications/issue-briefs/2021/oct/severe-maternal-morbidity-united-states-primer](https://www.cdc.gov/reproductivehealth/maternalinfanthealth/severematernalmorbidity.html)  *""While maternal deaths in the United States number about 650 to 750 annually, severe maternal morbidity affects approximately 50,000 to 60,000 women each year, and the numbers are increasing.""*   So you think it\'s okay to visit any level of violence on a woman as long as it doesn\'t kill us. Do you beat your wife to a pulp every night? Do you go around raping every woman you see? Why not? it\'s not killing us. Praise modern medicine! Amirite?   ANd when you FORCE a woman to stay pregnant and give birth, she is neither choosing to stay pregnant or accepting that risk. If she dies, YOU KILLED HER.   And you\'re perfectly fine with killing us in forced childbirth. You are pro-killing-women. Just say it. Just say that you want us dead.   It is if you\'re KILLING SOMEONE THROUGH FORCED BIRTH. If they could have gotten an abortion and didn\'t because of PL laws, PLERS KILLED HER. YOU KILLED HER.  Admit you\'re in favor of women dying to ""save babies."" Just say it. Say you\'re not in favor of protecting ALL life because you want women dead.   Allowing abortions allows women to get abortions and avoid childbirth. Abortion is far far safer than childbirth, and allowing every woman who wants an abortion to get one ensures that nobody is FORCED to risk death.   You don\'t, because they don\'t work. Women still die and you are fine with it. You say ""some women die, and it\'s tragic,"" and shrug and walk away. You rationalize it by saying it\'s perfectly fine to visit any level of violence on a woman you want--you may rape us, beat us, maim us, brutalize us--as long as you don\'t *kill* us. PRAISE MODERN MEDICINE. Amirite?   YOU ARE MURDEROUS. You want to hurt women, you want to commit violence against women, and you want to kill women. Just admit it. Just say that ""life exceptions"" means putting women in the ground, and you are fine with that. Just say that you are happy to visit ANY level of violence against a woman as long as it doesn\'t kill us, but also you\'re perfectly fine with killing us.  ""Women just die,"" you say. ""Our deaths are tragic but THINK OF THE BABIES,"" you say. ""I\'m fine with you dying,"" you say. Just admit it. Just own it. You\'re just as much of a murderer as you think I am.   More so, since killing women is killing actual PEOPLE, whereas killing a fetus is just killing a clot of tissue.', "" There is literally zero guilt here.  I'm not only pro choice I'm actively pro abortion.  It is a fantastic medical procedure that is a great thing to be available to a society.  Being pregnant and giving birth even if you plan to give it up for adoption is a life changing and stressful thing not to mention it can wreck your body.  Abortions have also prevented millions of kids being born into absolute terrible situations with basically zero chance of growing up normal and living a normal life.  If the adoption system in America and foster homes in this country weren't a giant cluster fuck I might lean a little more towards giving up for an adoption.  Not to mention lots of people get pregnant at a point in their life where having and raising a kid is not really an option.  Abortions have helped millions of people.  Again, a clump of cells that relies on being connected to a human to survive is not a person and is not alive.  You nut jobs can are somehow unable to understand this.  Let's assume they are, though. You have no thoughts or recollection of any of that.  It's really not a life.  If someone aborted me at 7 months I'd never have even realized it.  Also, assume abortion was made federally illegal.  What's your grand plan for all of these millions of kids born into terrible situations or given up for adoption?  You realize most people getting abortions aren't soccer moms that live in the suburbs, right?  They are poor people or people in bad situations that realize they are not in a situation to raise a child.  So you think the best option is basically force millions of people into a poor life of struggling and suffering vs aborting something that has no memory, thoughts, and will never even know they were going to exist and is the best option for all parties involved?  Get the fuck out of here with that ridiculousness.  If you don't agree with abortion then that's perfectly OK. Don't facilitate one or be with someone that approves of them.  But stay the fuck out of everyone else's life and ability to make this decision for themselves because in your opinion it's wrong.  You're more than likely some religious nut which really would explain a lot.""]"
2	87	2_capitalism_socialism_socialist_of	['capitalism', 'socialism', 'socialist', 'of', 'the', 'communism', 'is', 'proletariat', 'and', 'system']	"[""Prior to capitalism America was a free enterprise economy.  You made something or performed a service and you sold that for its market value.  The founders would not recognize a person who sells their labor on an hourly basis (because they lack the means to create saleable product) as a free person.      Capitalism took root in America during the railroad revolution, and that put the new wageslave system in to direct competition with southern chattel slavery.      Advantages to wageslaves are that they have to pay for their own housing, food and medical care and a wageslave who is unable to work due to illness or injury presents no liability for the enterprise. They can be replaced.  You don't get stuck owning a slave who is injured, or can no longer produce a full day of work.    Most importantly the wageslave system outcompeted traditional slavery because wageslaves work harder, believing it to be in their interest as they seek advancement.     But because the American wage system evolved to fulfill the same production needs as slavery it's not like work systems in the rest of the world.  It's primary advantages were severability of employment, and that owners had no need to provide for living conditions.    The ability for business owners to maximize profit while providing as little as possible to workers is the foundation of American capitalism."", ' I think for something to be considered a ""criticism"" of a certain economic system, it doesn\'t necessarily have to be exclusive to that economic system, but that the downside or ""con"" is much more apparent in one over the other.  Humans don\'t magically stop being greedy under other economic systems. For example, in a market socialist system (system in which there are a bunch of companies that compete with one another \\[similar to capitalism\\] but each business is collectively owned and operated by the workers of that specific business rather than a single individual or a group of wealthy shareholders), people are still greedy and will still act in their self interest. But, due to businesses being owned collectively amongst the workers, the profits of that business are more evenly shared and thus wealth inequality is lower and thus it is a lot more difficult for any one individual to easily corrupt the political system. Is it still \\*technically\\* possible for there to be corruption in a market socialist system? Yes....but it is much harder and much less likely.  The fact that capitalism makes it more likely that the political system and politicians can become corrupted makes it a valid criticism imo.', 'TL;DR stay a western shit-lib   If you actually read the content of those conversations where I ask for sources you’d find that they often have a running theme of me calling out people who make outlandish claims about communist political and economic topics. Ironic considering your commentary.   I will not deny I have not read The Civil War in France (1870) yet but besides that there’s nothing else you have said that has been further from the truth so fuck off with your profiling.  You said Marx had a different view of the Dictatorship of the proletariat from what MLs claim it to be. You also gave a very poor characterization of what MLs believe the DOTP to be. I detest people who do this type of shit then give a fucking Wikipedia article as their reference. The more politically charged a topic is the more a knowledge database where supposedly EVERYONE can contribute to the development of it has so many holes in how a communist could just take it with a grain of salt. Quotes can be cherry picked so easily it’s just more irony of the situation considering your original call out was about taking Marx out of context.   Lenin has already said plenty about the counter arguments posed by Kautsky in the 2nd International regarding Marx’s commentary on the DOTP (which is where you’re getting this from whether you’re aware of it or not):  ”Let us point out, in passing, that when calling the non-Bolsheviks in Russia, i.e., the Mensheviks and Socialist-Revolutionaries, socialists, Kautsky was guided by their name, that is, by a word, and not by the actual place they occupy in the struggle between the proletariat and the bourgeoisie. What a wonderful understanding and application of Marxism!”  “The question of the dictatorship of the proletariat is a question of the relation of the proletarian state to the bourgeois state, of proletarian democracy to bourgeois democracy. One would think that this is as plain as a pikestaff. But Kautsky, like a schoolmaster who has become as dry as dust from quoting the same old textbooks on history, persistently turns his back on the twentieth century and his face to the eighteenth century, and for the hundredth time, in a number of paragraphs, in an incredibly tedious fashion chews the old cud over the relation of bourgeois democracy to absolutism and medievalism!”  “But this means he utterly fails to understand what is what! One cannot help smiling at Kautsky’s effort to make it appear that there are people who preach “contempt for democracy” (p. 11) and so forth. That is the sort of twaddle Kautsky uses to befog and confuse the issue, for he talks like the liberals, speaking of democracy in general, and not of *bourgeois democracy*[my italics]; he even avoids using this precise, class term, and, instead, tries to speak about “presocialist” democracy. This windbag devotes almost one-third of his pamphlet, twenty pages out of sixty-three, to this twaddle, which is so agreeable to the bourgeoisie, for it is tantamount to embellishing bourgeois democracy, and obscures the question of the proletarian revolution.”  This view” (which Kautsky dubs “contempt for democracy”) “rests upon a single word of Karl Marx’s”. This is what Kautsky literally says on page 20. And on page 60 the same thing is repeated even in the form that they (the Bolsheviks) “opportunely recalled the little word” (that is literally what he says—des Wörtchens!!) “about the dictatorship of the proletariat which Marx once used in 1875 in a letter”.  Here is Marx’s “little word"":   First of all, to call this classical reasoning of Marx’s, which sums up the whole of his revolutionary teaching, “a single word” and even “a little word,” is an insult to and complete renunciation of Marxism. It must not be forgotten that Kautsky knows Marx almost by heart, and, judging by all he has written, he has in his desk, or in his head, a number of pigeon-holes in which all that was ever written by Marx is most carefully filed so as to be ready at hand for quotation. Kautsky must know that both Marx and Engels, in their letters as well as in their published works, repeatedly spoke about the dictatorship of the proletariat, before and especially after the Paris Commune. Kautsky must know that the formula “dictatorship of the proletariat” is merely a more historically concrete and scientifically exact formulation of the proletariat’s task of “smashing” the bourgeois state machine, about which both Marx and Engels, in summing up the experience of the Revolution of 1848, and, still more so, of 1871, spoke for forty years, between 1852 and 1891.”   [All of this and plenty more can be found in the 1st chapter of Lenin’s *The Proletarian Revolution and the Renegade Kautsky*](https://www.marxists.org/archive/lenin/works/1918/prrk/common_liberal.htm)   I doubt you will read all of this much like you won’t read that book but I’m plenty read on the subject of the dictatorship of the proletariat. How about you sit down with your pseudo-intellectual garbage like the rest of the anarchists and put your head down and do the actual reading.']"
3	85	3_yeah_sense_lol_makes	['yeah', 'sense', 'lol', 'makes', 'thats', 'exactly', 'trolling', 'troll', 'youre', 'point']	"[""Oh lol, you're just trolling and baiting that makes more sense"", 'Yeah, that makes sense.', 'Lol, yeah, that makes a lot more sense.']"
