Topic	Count	Name	Representation	Representative_Docs
24	35	24_race_african_black_racist	['race', 'african', 'black', 'racist', 'white', 'american', 'history', 'married', 'racism', 'skin']	"['I think it’s a lot more complicated than that. I am not a woman and I suspect you are not as well. But I do know that people make decisions based on a multitude of factors and it’s overly presumptive of either of us to conclude that one factor weighed more heavily in the decision to have a child. One factor that I had never considered was cultural norms around weddings in the south. I had an African American coworker whose family came from the south. She and her partner both earned good middle class income and they had a daughter without getting married. One day she mentioned that they hadn’t gotten married because in her culture marriage must be a large formal event. They couldn’t just have a small, private ceremony or go to the courthouse, or elope to Vegas like I did. They would have to have a big todo in a church with every possible relative or friend they ever knew or met there. And even for a middle class couple, that meant saving up for a long time. And it should go without saying that African American don’t have the kind of generational wealth where the parents of the bride and groom can just pick up the tab. When I’ve gone to any kind of fancy wedding, that’s usually the arrangement.', '…d you not know the difference in race and ethnicity?  In all the cases you mentioned, you are mostly confusing race and ethnicity which are completely different.   And a patients ethnicity being part of a diagnostic work up is wildly different than it being the best lens to view a disease which is what was said and what I responded to.   “Joseph Graves Jr, Professor of Evolutionary Biology at the University of Arizona in Phoenix, goes even further, saying that physicians should not use skin colour to diagnose and treat individuals, but only family history. ‘What most people would describe as African American, 80% of that individual’s genes originate somewhere in Africa. But others with the same appearance might have inherited varying amounts of genes from American Indians, Europeans and Africans,’ Graves said. ‘African Americans do have unique health needs,’ he acknowledges, but he also felt that the complex interaction between socioeconomic and environmental conditions contributed more than genetics. For instance, 90% of Africans in Nigeria have the 235T mutation in the ACE gene locus—a marker for hypertension—but only 10% actually have hypertension. Compare that with 85% of African Americans with the mutation, and over 30% who have the disease,”  If you’re actually interested in the subject and not just arguing your point, I’d recommend the below article on the subject. Lots of physicians are researching this and not because of liberals pushing their agendas.   https://www.ncbi.nlm.nih.gov/pmc/articles/PMC1084221/', 'Thank you. I will. I am actually mesmerized by the African-American slavery experience, and the History of the USA. I just can\'t stop reading and researching it.   My great-grandaparents on my mother\'s side were African slaves brought to Cuba. My maternal-grandmother could speak YOURUBA. My mother could understand it, but not speak it. I can do neither. But, the differences between a black Cuban, and a black American are really startling. I was very taken aback when I realized Black Americans did not play African drums. Later I learned they actually can\'t. Neither do they believe in African deities. It stroke me as weird, until I researched the true reason. Their History has been erased.   Black Americans are the only blacks in the world who can\'t play African drums, and don\'t believe in SANTERIA. Every single African group in the world will do these two things. And also, not ONE black American I have spoken to knows which part of Africa they descend from. They just don\'t know. Their entire History has been erased. I\'ve even have met African-Americans who do not actually know where Africa is. And to me that is simply ABHORRENT. But, that\'s the way it is.   On my father\'s side my Black African great-grandmother married a white Spaniard. She was brought in to Cuba as a slave. But this Spaniard guy fell in love with her. And he purchased her freedom so they could be married. Tha Law did not allow for a free individual to marry a slave. They could either be both slaves, or both free. And they finally married. Neither of them was lynched. An scenario like that was absolutely impossible in America until 1957 with Loving vs. Virginia. And then I learnt about Emmitt Till. I couldn\'t believe it. American slavery of blacks was so unique in so many aspects. And much of the ostracism of blacks still remain in place.  America\'s RACISM is baked into the American society. You just can\'t escape it.   I could not understand REDLINING, so I bought a book ***""The Color of Law"".  The forgotten History of how our Government Segregated America.*** I could not believe it. It was very hard for me to understand such amount of evil-doing. The only other system I know with such a great evilness is Communism. But, in Communism you are discriminated against for POLITICAL, not RACIAL reasons. I went to school with every other kid of every other race, or skin color. We all lived in the same *barrio.* We all went to the same schools. We all dated whichever girls. It took a great deal of studying, and researching in order to comprehend REDLINING, JIM CROW, and all these other segregation  Laws. It was extremely hard.']"
25	35	25_vaccine_vaccines_covid_vaccinated	['vaccine', 'vaccines', 'covid', 'vaccinated', 'flu', 'doses', 'vaers', 'unvaccinated', 'the', 'covid19']	"[""You seriously believe the vaccine saved millions of lives? Who told you that, Trump or Fauci?? It is proven to be nearly zero percent effective, please stop believing what the Tell-A-Vision tells you and help some others from your generation to seek the truth. I'm not here to argue with my fellow peasants, we are all nothing to them, but I do enjoy sharing truths. The vaccine is ineffective and it's harmed even your favorite actors and musicians (which I find odd because I would think they would all warn each other), but I guess the WHO and CDC don't care about their puppets. I find it unbelievable that you think the vaccine saved any lives whatsoever and I think you have allot more research to do, please do not use YouTube or Google though if you want the truth..."", ' It was emotional jujitsu. Their momentum was used against them.  Everything they were studying, at it\'s core, was about caring and helping people. This was central to their being. So all the state had to do was introduce a mind-virus, one that said, ""If you care about Grandma..."" The early covid scare, and the following vaccine, was never really sold to ""individuals"" (though individuals certainly ran with that angle), it was sold as a way to save the most vulnerable among us.  Masks, like vaccines, like shutdowns, weren\'t sold as a way to protect ourselves, they were sold as a way to protect *others.* And in this the trap to the academic left was laid and sprung. It was to save Grandma. It was to save the children. It was to serve all those constituencies and vulnerable that they spent so many decades learning to protect from rapturous capitalists, and all those capitalists had to do was change their \'antigen\' as it were, and with this they slipped right past all the carefully developed intellectual immunity the left had built up.  And from there, like any good con, the mark either won\'t accept, or admit, they were taken, and they\'ll rationalize away why they continue to justify playing along, just waiting for the next crisis to let them move their Caring Fetish to a fresh target.', ""If someone has had the vaccine and dies, it gets reported to VAERS. That does not mean the vaccine caused the death.  Around 2 million people die each year in the US. Over 50% of people are vaccinated. Therefore you'd expect over 1 million vaccinated deaths a year.  Therefore if there are only 30k reports, you are correct, it is an undercount. However, it not indicate a causal connection.  VAERS is the system that's used to discover statistical anomalies (termed signals) that can then be investigated to determine if there is a causal connection.  VAERS is not a system that can be used to determine causes of death. In fact, if you have read the reports on VAERS (anyone can) I have spotted reports that said the deaths were not related to the vaccine - e.g. lady fell and hit her head.  Like the other commenter, I'll ask where is the evidence over 30k people have died from the vaccine?""]"
26	35	26_vote_democrats_republicans_candidate	['vote', 'democrats', 'republicans', 'candidate', 'republican', 'supported', 'voted', 'duopoly', 'gop', 'voting']	"[""I think the effective standard here is that at least 10 Republican Senators supported cloture. The list of accomplishments doesn't include anything passed through budget reconciliation, so everything on the list got support from 10 or more Republicans in the Senate.  That doesn't mean both parties equally supported the bills, but if 20% of Republican Senators supported it, it seems fair to call it a bipartisan bill."", ""They have one choice who they vote for, but they can all vote.  That's how a number of democratic dictatorships work.  Even in America, we mostly only have two choices when it comes to the federal level, the majority of them all working towards the same goal (a duopoly)."", 'Many are barred by work schedules that prevent them from even going to polling places during the hours they operate. A high percentage lack the experience and know how necessary to properly register and maintain the appropriate identification to vote. This includes people who are going to school in a different county than they actually live in even with them being a Texas resident.  It didn’t help that TX has some of the shittiest Democrat candidates West of the Mississippi. Hell, we have Dems here who are anti-choice (Henry Cuellar for one).  I voted and my wife voted, but a lot of our friends are too busy working 2 FT jobs to pay rent that they just didn’t have the ability to go vote without risking getting fired and/or going homeless.']"
27	34	27_her_she_shes_omar	['her', 'she', 'shes', 'omar', 'harris', 'hobbs', 'as', 'story', 'condemn', 'top']	"[""Why don't I like her?  She's just not likable.  I'm not a bigot, this is all her fault! 🤡  Policy-wise, Harris and I are a world apart.  Not my choice for VP let alone the nominee.  But the over the top hatred and bile spewed at her around here is really really gross.  Harris is absolutely competent to step into the role of POTUS if required.  That's literally the only thing that matters wrt her right now.    There's zero good argument that replacing her on the ticket would do more good than harm politically.   So people need to calm tf down about her.  There will be a competitive primary to determine the nominee in 2028.  You will have a perfect chance to see how the actual party feels about her then instead of a bunch of privilaged young dudebros insisting everyone hates her just as much as they do."", 'Nonsense.  She has been promoted as a leading voice of the progressive Democrats far more than almost every other far left, ultra progressive Democrat, which puts her in the public eye more.  She also intentionally draws a huge amount of attention to herself, such as with her fake crying bullshit or when she showed up to the Met (a 35k/ticket event) with a ""Tax the Rich"" dress or when she acted like criticism of her was because people wanted to sleep with her.  She also has taken insanely stupid positions like with the Green New Deal or her ""morally right"" vs. factually correct comment.', 'Here\'s another article about Omar voicing antisemitism.   [BBC.](https://www.bbc.com/news/world-us-canada-57436573)  The top Democrat on the House Foreign Affairs Committee condemned Ilan Omar as an anti-Semite. This isn\'t the NY Times taking something President Trump said out of context and calling it a lie in an opinion hit-piece:  this is a senior member of her own party who called her a bigot on the record. [Rep Eliot Engel (D-NY](https://www.foxnews.com/politics/top-foreign-affairs-democrat-calls-rep-omars-comment-vile-anti-semitic-slur)).  Here\'s *another* artcle about her doing it *again*... by left-leaning [NBC News](https://www.nbcnews.com/politics/congress/rep-ilhan-omar-criticized-again-what-critics-call-anti-semitism-n978521).  Omar claiming that the US has a ""System of Oppression"" that needs to be ""dismantled"" (her words).  [Fox News](https://www.foxnews.com/politics/ilhan-omar-dismantle-americas-economy-political-system-oppression).  Meanwhile, she was silent when terrorist organization BLM supported a nation with an *actual* system of oppression that runs political prisons and has slaughtered thousands of innocent people:  Cuba.  [Fox News](https://www.foxnews.com/politics/aoc-omar-black-lives-matter-cuba).  Despite her examining everything her opponents say with a fine-toothed comb looking for any reason (real or imagined) to condemn them - Omar refused to condemn the recent Antifa firebombing of a government facility in Tacoma, Washington even though she was asked a direct question by a reporter.  Mind you, she responded to the question (so she heard it and answered it)... she just refused to condemn *firebombing a government building* because it was her side doing it. [Washington Examiner](https://www.washingtonexaminer.com/news/ilhan-omar-refuses-to-answer-reporter-asking-if-she-condemns-antifa-firebomb-attack).  Edit:  those are six different cases of Omar doing what I said she was doing, some are from left-leaning sources, and the two centrist sources for the others quoted her directly.  How is it that you claim to know about her, yet seem completely unfamiliar with her actual words?  You could have pulled up those articles (and hundreds more) just as easily and quickly as I did.']"
28	34	28_warming_climate_atmosphere_we	['warming', 'climate', 'atmosphere', 'we', 'temperature', 'co2', 'planet', 'cycles', 'rte', 'the']	"['That’s why it’s called CLIMATE CHANGE. Because there’s warming and cooling going on at the same time. The overall trend is warming which we will see in the coming decades if no action is taken, but the sudden anthropogenic influx of co2 is causing instability and therefore fluctuation of earths climate system resulting in both warming and cooling. But mostly warming, especially in the polar regions over the last few decades. I literally have a mountain of evidence to back me up. Deny all you want, but there is a ton of research proving my point. I understand the paranoia about the mainstream media spreading lies because they do that in many ways and they definitely have an agenda, but seriously, this is real. I am not repeating what I saw on the news. I am repeating what I have learned in high school and college classes and peer reviewed scientific research on the internet.', "" Good thing we are aware of things like this.... And that it is measurable so we normalize this....Because the models sure do... Otherwise they wouldn't function. This is why we always have to normalize for things like time of year elevation and other location based factors. It is generally easier to do this via remote sensing where you can cross reference the data with topology and land use data.. even rural areas suffer from the heat island effect you just have to use a higher resolution to detect it properly... It's a built structure area witch comes with other issues such as impermeability. This has and continues to exacerbate flooding downriver of urban areas.    Again this is the only time that he accurately speaks about climate    The tools for detecting tornadoes get better so we are able to find them easier, we can't change the past but updating how we take our measurements may help us in the future.   It seems that they are against the types of city planning that is more impactful. Such as walk ability and public transit. I have heard this everywhere since I have been working with city planners.    They chose this because of the quality of data.... It's not cherry picked because we didn't have the technology developed yet, if we were able to go back in time to get better flyover data we would but we got to deal with what we got      I made a mistake, in interpreting the data as it wasn't clear to me from his chart, that would explain the strange results he had...  That being said it's interesting that he compares these changes that happened over an even longer time scale to the potential warming from our current spike in CO2 production.  If anything the time periods were when less CO2 was sequestered meaning that temperature and CO2 are correlating factors, this is corroborated with my graph previously linked where temperature trends lasg behind CO2 trends. Thank you for pointing that out.   Yes evidence that they chose and often misinterpreted or old data that isn't still accepted. They often choose to ignore progress in fields such as remote sensing which has been key to our progression in the climatology field.   Lastly they never presented a comprehensive model that has higher predictive power than the ones in circulation today. While they often are starting issues with modeling as a whole or older issues we have worked past they fail to then quantify and qualify their implications to the models at play already. Also the IPCC is a report not a model so it's not the strongest form of evidence."", 'Basically, humans are dipping into fossil fuel reserves locked up underground by natural geologic processes of the carbon cycle and releasing carbon dioxide into the air. Carbon dioxide is a gas that traps heat (which is a greenhouse gas), so the more of it there is in the atmosphere, the warmer it gets. We keep on adding carbon dioxide to the atmosphere by burning fossil fuels, so we are continuing to cause warming. However, it isn’t as simple as adding carbon dioxide directly increases warming. The addition of carbon dioxide and subsequent warming causes instabilities in other parts of the earth system, for example the salt concentration of ocean water. The warming causes melting of ice caps, which lessen the saltiness of sea water and disrupt ocean currents. As I mentioned before, the disruption of the Gulf Stream by the melting of Arctic sea ice and the Greenland ice cap could disrupt the flow of the Gulf Stream to Europe, thereby plunging Europe into freezing temperatures as it is in a high latitude and is only kept mild by the warm Gulf Stream current. This is just one example, and the gist of it is that the addition of co2 to the atmosphere will cause a chain reaction of climate effects that will be entirely unpredictable. The only thing we can predict is the increase in atmospheric co2 concentrations, which will inevitably destabilize the climate. And the natural climate cycles never happen this quickly. Sure, we have the odd volcanic eruption that results in cooling, or increased solar activity that results in a little bit of warming, but we have seen an unprecedented increase in warming over the last 100 years, which directly correlates to the addition of co2 to the atmosphere by humans. Natural cycles do not cause change on such short scales, the processes that change the temperature/climate of earth either release co2 into the atmosphere (weathering of rock), or affect earths orbit/position (milankovitch cycles) operate on 1,000s to 100,000s of years. Meanwhile, this change has been occurring over little more than a century and directly parallels human consumption of fossil fuels, and is rising exponentially instead of at a steady rate. By the way, I learned a lot of this in my environmental science class but also through research.']"
29	34	29_biden_his_joe_age	['biden', 'his', 'joe', 'age', 'old', 'best', 'he', 'saying', 'him', 'win']	"[""Oh man old Biden was basically a Republican and the guy has a lot of flaws. Having said that people do change politicians included and America has watched him grow. Biden has shown that he has a very important leadership quality that the right is completely bankrupt in—compassion. And whether or not I agree with his approach to policy I can at least have confidence that he personally believes it is in America's best interest  How do you feel about the fact that Trump doesn't have a single success story on his resume beyond putting a woman in charge of Trump Tower back when nobody else would and a string of scams and failures?"", ' ""vote for us so we can barely pretend to fight for a policy platform marginally closer to your interests, lose, and then blame you for it"" is a different strategy than fighting to win. dems would need to take the fight a little more seriously if they want me to buy it.   &amp;#x200B;   biden received donations from [more billionaires than trump](https://www.forbes.com/sites/michelatindera/2020/08/08/biden-pulls-away-in-race-for-billionaire-donors/?sh=7c0ecb9d3b62), which probably has a lot to do with his senate record consistently of voting for things those billionaires wanted  &amp;#x200B;   what\'s best was letting the railroad companies fold to the unions instead of helping them. or better yet, letting them strike and using the opportunity to nationalize their shitty bare-minimum infrastructure &amp; give the unions what they want to produce a sustainable railroad engineer workforce.   biden decided to do what\'s best for railroad CEOs, which is hardly even what\'s best for the railroads, since it\'ll just mean more people leaving the industry for ones that do have paid sick leave.  &amp;#x200B;   his dropping &amp; endorsing both joe &amp; hillary is why it\'d be hard to consider even voting for him again. it\'s difficult to buy that he wanted to win those elections.', ""There's no logic to misrepresenting the science.  It's actually pretty fucking gross.    In truth the science behind cognitive decline makes no such pronouncement that cognitive decline becomes likely at X age.  In fact, recent studies have strongly suggested lifestyle is a far stronger determining factor on the likelihood of cognitive decline than age.  And guess what? Biden takes better care of himself than the overwhelming majority of Americans.  Basic logic is to let the man, his family, and his medical staff make those determinations.  Not edgelords on social media that have no clue what they're talking about.  I believe Biden to be an honorable man looking to do what's best for the nation.  I see no reason to indulge in the idea you or others know better than Joe and his inner circle what his mental capacity is.""]"
30	34	30_nazi_nazis_hitler_you	['nazi', 'nazis', 'hitler', 'you', 'classical', 'victims', 'trope', 'why', 'call', 'called']	"['Nah, pretty sure we all know what Nazi means. If you think that jews cannot be called Nazis, then you really have zero clue about WWII. Thanks for exposing your ignorance, Nazi bootlicker!', 'My family came from Germany during the war. I’ll not have some half breed Redditor tell me I’m not a Nazi. We do not control who we love.   I could list 10 Nazis. Actual Nazis not just larpers. Who were involved romantically with Jews, or men.   So go ahead really tell me a full blood kraut with a family history to boot. That I’m not a Nazi while you cope. I can smell the 20% Irish 30% Scottish from here.   I’ve a knack for sniffing it out. Runs in the family.', ""Well thanks for letting the readers know that you are not just delusional but deranged by some kind of russophobia.  Not sure what imagined classical tropes you rambled about. Donbas Militia destroying nazis is now a classical trope? Nazis on their knees sucking dick for foreign money is a classical trope? Nazi trolls can't brigade this sub because their electricity is turned off is a classical trope?  Go ahead and elaborate for the readers which of the observed phenomenon are classic tropes at this point and maybe the readers can update their lexicon to understand the ramblings of nazi glorifiers. We are expecting an answer :)""]"
