Topic	Count	Name	Representation	Representative_Docs
11	53	11_ukraine_russian_ukrainian_russia	['ukraine', 'russian', 'ukrainian', 'russia', 'we', 'russians', 'the', 'and', 'nazi', 'in']	"[""They do have their own problems with nazbols, they shouldn't be supported uncritically. If one doesn't consider the project already failed and more or less ceded to the Russian Federation.   Most of the communists, those of a more international position, who were associated with the projects of Lugansk and Donetsk republics have fled, hid or died in various assassinations and artillery shellings. The communists were seen as the larger threat, as they specifically addressed ethnic Ukrainians in the Ukrainian language in their propaganda. They were primary targets of the post-coup Ukrainian government. For them, Donetsk and Lugansk were supposed to be successors of a legitimate Ukrainian SR, that could potentially grow if more people rebelled against the coup. The Dugin-influenced patsoc's are more friendly to the Russian Federation. Safety for ethnic Russians, rather than socialism, is the core of their position, so they get better protection from Russia. They have become the primary political force in the separatist regions.   While these ethnically Russian Patsoc's are obviously quite wrong, and dangerous to minorities in Russia, they did not spring from nowhere. There are tens of thousands of stateless ethnic Russians who were denied citizenship and rights in various post-soviet states, including Ukraine, and lacked the means to go somewhere else at their own expense, as was demanded by the new states. While there is plenty to be said for Russian imperialism before the revolution and their status as a dominant or preferred ethnicity in conquered territory, and for chauvinist attitudes in later years, that is not the universal experience. It also doesn't help that they adopt a nostalgia for the Soviet Union and its imagery, but without socialist politics, which is shallow and deceptive.   At best, one could argue that they make the necessary compromises to mobilize ethnic Russians against western capitalist influence. At worst, and I'm quite pessimistic, they belong to capitalists more fully than they admit and lack revolutionary potential on the basis of that ethnocentrism. But I can acknowledge people who hold the former view as comrades even if I don't do the same with regards to the governments and organizations in question."", ""You'll appreciate these:  A cyber cat-and-mouse game ensued, with the United States, Britain and other allies helping to shore up Ukrainian computers and stave off Russian intrusions.  On Feb. 23, hours before the invasion began, Sandworm took another swing, launching malware that infected several hundred Ukrainian government computers, officials said. The intrusion was detected quickly, the damage contained.  Then Sandworm struck again. But the code it used looked like it had been thrown together at the last minute, with programming errors — another fail.  Sandworm wasn’t done. In its boldest stroke yet, it went after the Ukrainian military’s satellite communications, used by soldiers in the field. It worked, and by 6:15 a.m. on Feb. 24, the system went down, right at Ukraine’s most vulnerable moment.  It could have been a crippling blow. But the Ukrainian government had a backup plan: a separate satellite communications system, which it had tested only two months before, to make sure it was ready in the event of a Russian invasion.    ...  Ukrainian law enforcement officials started noticing something else suspicious as well: a spike in foreign cellphone numbers near the border, in the forests between Ukraine and Belarus.  Russian soldiers were using cellphones to call home, and suddenly popping up on Ukrainian networks. Officials who monitor the traffic during peacetime for criminal activity quickly realized they could see and hear the invaders approaching in real time.  “We listened to the Russian soldiers as they panicked and called their friends and relatives,” said an official who oversees the phone intercepts. “They used ordinary phones to make decisions about their further moves.”  Down long corridors guarded by locks with facial detection, behind doors sealed with wax to detect intruders, teams of women tracked the Russian troops from small listening booths while their friends and relatives grabbed rifles to patrol the streets.  “We understood where the enemy was, what numbers they were using,” the official said.  The eavesdroppers passed the details to Ukraine’s armed forces to carry out ambushes and counterattacks. Maj. Gen. Kyrylo Budanov, the head of Ukraine’s military intelligence, said Ukrainian forces used cellphone signals and even TikTok videos to target a unit of Chechen soldiers known as the Kadyrovtsy, named for the strongman leader of Chechnya, Ramzan Kadyrov.  It took 40 minutes from the time one video was uploaded to pinpoint the unit’s location near the Hostomel airport northwest of Kyiv, Mr. Budanov said. The Ukrainian military then hit them with three Tochka-U ballistic missiles, he said.  The Russians kept closing in on Kyiv, forcing the eavesdroppers tucked in listening rooms to make a quick decision: destroy their equipment and flee for their own safety, or hang on and continue gathering intelligence.  They stayed.  “We didn’t lose Ukraine. We didn’t let the enemy move further,” the official said. “On the first days, when they made foolish mistakes, we used their foolish mistakes to our advantage.”"", 'If El Paso had been embroiled in a separatist movement for 8 years yeah I really wouldn\'t have a problem with it, especially if not allowing El Paso to be independent meant the loss of hundreds of billions of dollars, hundreds of thousands of lives, massive damage to US infrastructure, and a decades spanning crippled economy. The Donbas and Eastern Ukraine has always been a contested area, even in the original elections those areas went to Ukraine by margins so narrow that in the US we would have held special elections for in many areas. Let\'s not pretend that these areas were the same as the rest of Ukraine, that Putin ever voiced interest in any area outside of these hotly contested areas, or that the people in these areas don\'t blame Ukraine for the war and not the Russians. You don\'t even have to read Russian sources, the financial times conducted interviews in Bakhmut and even the Ukrainian military in the area said that was a common sentiment in the area.   Let\'s also not forget that Zelensky ran on a platform of making peace with the Russians and ran on that platform but proceeded to do the opposite due to pressure from the West.   For the record I don\'t believe NATO troops are in Ukraine or that Ukraine is full of Nazis, I do believe that these areas of Ukraine have wanted independence for a long time, have fought for this independence for a long time, and that Ukraine doesn\'t really care all that much about these areas since they conducted shelling operations in these areas the day before the Russian invasion in violation of the Minsk accords. About dictators today that we support, Egypt? Saudi Arabia? Alegeria? Afghanistan (hardly a democracy, run by a warlord before that fell apart)? There are quite a few oppressive regimes and dictatorships we fund.  As for the Belt and Road initiative, how exactly is increasing a military budget going to help solve that? Are we going to start bombing countries for having Chinese funded infrastructure projects? It\'s not as though the Chinese government is sending its military to these places, they are using money and deals to gain and exercise power, and that\'s not something we can stop with guns and missiles. We can\'t just send soldiers to a country\'s port and say ""we own this now"", we\'d look like thugs because that\'s exactly what we would be.   Yes Russia is making friends in Iran and Syria. What the hell else do you expect them to do? We have cut them off from the rest of the world. We create enemies with our attempts at ""spreading democracy"" which is just code for ""we just want people in charge who we are friends with"" then cry and panic when it fails and other countries who we don\'t like make friends with the countries we made enemies out of. There is a reason why the Iranians don\'t like us and that\'s because we did a regime change in the 40\'s, the Syrians don\'t like us for the same reason.   Yes, as a NYC resident and native I\'m well aware of 9/11, but had our government exercised any competency it never would have happened, it was a preventable tragedy. All the whole war on terror, aka America\'s pissing contest with Islamofascists, did was make more people side with the Islamofascists because when your family is killed in a drone attack you lose all sympathy you may have had for some Americans that died in the WTC. Also, who was supporting the Taliban, Al-Queda, ISIS, and all these other groups before they attacked the US???? The US. WE CREATE OUR OWN PROBLEMS. The interventionism inevitably fails because we back losing causes, we increase resentment towards us, and our takeaway is that next time we should intervene harder. We are chasing the illusion that every country we dislike is like Nazi Germany and that if we win we can create a functional liberal democracy like we did there.   I think you overestimate Ukraine and misunderstand the Russian strategy, blitzing quickly may have been the original strategy but ever since April the new strategy has been the war of attrition, camp the positions, abandon areas that aren\'t defendable, and wait out Ukraine and it\'s working. Ukraine is running out of weapons, the new ones they are getting although more advanced cannot be maintained in the Ukraine and have to be sent to Germany for repairs (as the people who know how to fix them cannot be in Ukraine as the Russians would treat it as an act of war) and this will only further stress the already overworked supply lines into Ukraine. 100 billion dollars spent and can we really say that they caused 100 billion in damages to the Russian military or prevented 100 Billion dollars in damages to their own country? Most of Ukraine\'s energy grid is in the crapper, most are on the brink of starving or freezing this winter, is this what victory looks like? Was all this worth it?   I also think you overestimate effect of sanctions on Russia and underestimate the undeniably worse effect they have had on the West. Europe is going through an energy crisis, fertilizer increased in cost substantially, there are food shortages across the world. We have also permanently ensured that Russia will never rejoin the global financial system no matter who is in power because of the animosity we created by ceasing the assets of Russian civilians abroad. Now Russia and china are creating their own financial system which they will use with their new friends in the middle east to trade oil, which is a massive blow to the dollar.   I love America, I love the country, I love it\'s people, I love the constitution. What I don\'t love is our insane approach to foreign policy and our indifference towards the horrors of the wars we cause and escalate. If we stayed out of political conflicts in countries we don\'t understand and focused our efforts on development and improving our own country we wouldn\'t have these problems.']"
12	51	12_gun_states_guns_laws	['gun', 'states', 'guns', 'laws', 'you', 'firearms', 'youre', 'with', 'to', 'rifle']	['A shotgun can hold 8 or more shells at a time. So if someone walks into a school and shoots 8 kids with a shotgun, which is wayyyy deadlier than an ar15 round for round, we’re just gonna say it’s fine for shotguns to still be legal because it’s only 8 kids instead of more? That’s not how it works. Shotguns will be next and then it’ll all be illegal. Look at canada.    A car you need nothing to buy one. To drive on the road you need that stuff. I already said that. And that’s how guns are also regulated in most states. You need a permit to carry concealed in public.   “Prove you’re not a criminal and mentally competent” to prove I’m not a criminal all I need is a background check ,which is already a federal law and to prove someone is mentally competent how is that done? I already asked you how should that be accomplished ? You don’t just sit down with a therapist for an hour and they’ll know that you’re not a psychopath. This needs to be a thing way before the purchase of a firearm, sooooo mental health support from a young age ….   That was canadas murder rate before they literally banned all firearms. That’s my whole point. You’re saying to just put in place common sense laws and it’ll end there but it doesn’t end there they keep pushing for more until all firearms are banned and now we get to the true belief that you’re ok with all firearms being banned eventually. So this idea of “we only want common sense gun laws” is bs.  I live in California and it started with “common sense gun law” and now we have laws that literally make 0 sense and everyone with 2 brain cells think they’re stupid. Even anti gun people think they’re stupid.  They tried to basically ban permitted concealed carry when concealed carriers have never been linked to any type of gun violence. It’s nonsense. They put a funny looking grip on an ar15 and say they banned assault weapons. It’s literally the most uncommon sense ever  If someone came up with something competent I’d be the first person to give them credit', 'So 6 states out of 50 have lower gun deaths based on their gun laws but the other 44 states are all over the spectrum all with loose gun laws. And California, Massachusetts, Hawaii, and New York off the top of my head are all really nice states to live and have a ton of funding from tourism. So what I’m trying to say is I think those states would probably have low crime either way. But there’s other states that have loose gun laws that also have low gun deaths too … so I don’t see it.', 'You addressed almost none of the points I made though lol. You’re just saying gun control talking points without making any real counters. Yes brazil is a very poor country but what does overall wealth of the country have to do with the effects of guns in the country ? Those are totally different statistics.   I already addressed the car license thing but you obviously either didn’t read what I said or are choosing to ignore it. You also don’t have to prove you’re not crazy before buying an 800 hp dodge demon and driving down the road with it.   Attacking mental health should be priority because it’s the root of the problem. If you fix the root of the problem there’s a high probability that you wouldn’t have to take gun rights away.   The idea of FREEDOM I CAN OWN WHAT I WANT has nothing to do with the point I’m making about semi automatics that you’re also not addressing.   You act like other countries around the world all live in total harmony with no one being victimized. In a lot of these countries you can’t even defend yourself without being put on trial for murder because they don’t even let you defend yourself. Canada had hardly any violence in the first place and they started with “common sense gun laws” and now they’re pretty much banning all guns in canada lol. You also act like everyone in those countries agree with those laws which they don’t.   Weve had “military style weapons” for over a hundred years.  Gun ownership in America has risen drastically and overall violence has dropped drastically over the years. You’re just really not addressing any points I’m making here.   What do you propose is going to solve this problem ? Mental health checks and banning all semi automatic weapons ? Because it goes from “common sense” to banning almost everything pretty fast.  This is an issue where people advocating for gun laws know nothing about firearms and that’s clearly the case here with you. You should learn about something you’re advocating for before forming an opinion imo. Learn about the way firearms work and you’ll quickly figure out how this plays out. You either ban almost everything or nothing at all. There really is no inbetween.']
13	48	13_elon_his_he_twitter	['elon', 'his', 'he', 'twitter', 'elons', 'hes', 'word', 'about', 'sticking', 'has']	"['But Elon’s is more expensive', 'These days? This has been the norm since the revolution. Look at what Jefferson said about how the US military should be handled before and after being chased through mountain forests because he assumed a militia would have the same fortitude and strict time adherence as the continental army.            Sticking to your word can be a problem if you don\'t change in the face if new evidence. Elon already got to see how Twitter worked before he made this choice. The original word was tainted from the start. It was obvious.            He always does this at software companies and has since the 90s. His implementation details are dated. He can\'t handle the ""scope"" of these projects, regardless of perceived maximum difficulty  problems. He is much better at hyping up teams on individual parts and broad physical goals. The problem is that software enables fixed tasks as a goal while physical goods are often sold as enabling infinite possibilities.                         He has admitted this many times in his autobiographies. The way he talks about not listening to his programmers and sysadmins(now *Ops) is funny in an Icarus sort of way. He was removed over such shortsighted choices at PayPal.', ""Well then just go to literally every other subreddit on this vast website then and stop having a whinge about imaginary Elon fanboys.  You are proving the strawmen you've conjured right by getting tilted enough to make memes about it, almost like you can't handle the great freeze peach (lol, jk).  Pointing out the blatant hipocrisy and hilarious, obsessive butthurt of cultural left mouthbreathers is not the same as actively fanboying for Elon himself. Yes he's cringe af, but he's also probably the least harmful billionaire on the planet.  In fact in all my hours of shameful chronic lurking of Reddit I've never once seen this boogeyman of the Elon dickrider ever existing, just 10000 copy and pasted comments complaining about them and dunking on these hypothetical bad guys. The closest is people sick of seeing the constant hate and copium parade like myself.  Almost like there is a massive bot squad pushing a narrative on every poupar sub to keep the Elon Bad hype train chugging, and engaging with each other to fake organic discussion and then uniquely chromosomed people are swallowing it hook, line and sinker.""]"
14	48	14_pizza_logo_andrew_taco	['pizza', 'logo', 'andrew', 'taco', 'uptown', 'kline', 'bell', 'sauce', 'besta', 'address']	"['What\'s insane to me is that there are people who think this is evidence.  Besta\'s pizza\'s logo *reminds* them of a separate design, and the lawyer (not owner) for Besta Pizza has the same name as a lawyer working at the Justice Department (but is provably not the same person).  What\'s even crazier is when people think that this is evidence against Comet Ping Pong.  It\'s as if the police raided your house because your neighbor has a Canadian flag. ""The maple leaf looks like a marijuana leaf so you might have a grow room in your basement, whether or not you have a basement.""  What is even the theory of Besta\'s logo? Do you think that pedophiles driving by will see the logo and think ""hmmm ... maybe that\'s a secret symbol meant for me. I should go in and ask if they have any children for rent?"" Do you think that\'s how things work?', ' Besta Pizza is/was owned by Uptown Pizza, Inc. The registered agent (not owner) for Uptown Pizza is Andrew Kline with the address ""1225 19th Street, NW, Suite 320, Washington, DC"". That\'s the address for Veritas Law and we find [this Andrew Kline](https://theveritaslawfirm.com/meet-the-team-andrew-j-kline/), who works extensively with restaurants.  It\'s a completely separate guy from the Andrew Kline that worked at the Justice Department.', ' Except ... it\'s bullshit.  Besta Pizza is/was owned by Uptown Pizza, Inc. The registered agent (not owner) for Uptown Pizza is Andrew Kline with the address ""1225 19th Street, NW, Suite 320, Washington, DC"". That\'s the address for Veritas Law and we find [this Andrew Kline](https://theveritaslawfirm.com/meet-the-team-andrew-j-kline/), who works extensively with restaurants.  It\'s a completely separate guy from the Andrew Kline that worked at the Justice Department.']"
